time,description,home_score,away_score,team
12:00,Donovan Clingan vs. Ivica Zubac (Deni Avdija gains possession),0,0,Trail Blazers
11:41,Ivica Zubac blocks Toumani Camara 's 8-foot driving floating jump shot,0,0,Trail Blazers
11:36,Kawhi Leonard defensive rebound,0,0,Clippers
11:34,Derrick Jones Jr. makes two point shot (James Harden assists),0,2,Clippers
11:22,Shaedon Sharpe misses 10-foot pullup jump shot,0,2,Trail Blazers
11:18,James Harden defensive rebound,0,2,Clippers
11:11,Ivica Zubac misses layup,0,2,Clippers
11:08,Jrue Holiday defensive rebound,0,2,Trail Blazers
11:05,Shaedon Sharpe makes 3-foot dunk (Jrue Holiday assists),2,2,Trail Blazers
10:46,Kawhi Leonard makes 14-foot pullup jump shot,2,4,Clippers
10:31,Shaedon Sharpe makes 14-foot pullup jump shot (Donovan Clingan assists),4,4,Trail Blazers
10:01,Ivica Zubac makes 9-foot hook shot (Kawhi Leonard assists),4,6,Clippers
9:49,Jrue Holiday misses 25-foot three point step back jumpshot,4,6,Trail Blazers
9:46,Deni Avdija offensive rebound,4,6,Trail Blazers
9:45,Jrue Holiday makes layup (Toumani Camara assists),6,6,Trail Blazers
9:27,James Harden makes 27-foot three point step back jumpshot,6,9,Clippers
9:27,Deni Avdija shooting foul,6,9,Trail Blazers
9:27,James Harden makes free throw 1 of 1,6,10,Clippers
9:17,Ivica Zubac blocks Deni Avdija 's 5-foot two point shot,6,10,Trail Blazers
9:14,Kawhi Leonard defensive rebound,6,10,Clippers
8:58,Donovan Clingan blocks James Harden 's 24-foot three point step back jumpshot,6,10,Clippers
8:57,Clippers offensive team rebound,6,10,Clippers
8:55,shot clock turnover,6,10,Clippers
8:41,Shaedon Sharpe misses 25-foot three point jumper,6,10,Trail Blazers
8:38,Ivica Zubac defensive rebound,6,10,Clippers
8:30,Kawhi Leonard makes 8-foot two point shot,6,12,Clippers
8:16,Deni Avdija makes 24-foot three point jumper (Jrue Holiday assists),9,12,Trail Blazers
8:00,Kawhi Leonard misses 25-foot three point pullup jump shot,9,12,Clippers
7:58,Ivica Zubac offensive rebound,9,12,Clippers
7:58,Ivica Zubac misses tip shot,9,12,Clippers
7:57,Deni Avdija defensive rebound,9,12,Trail Blazers
7:53,Kawhi Leonard personal foul,9,12,Clippers
7:53,Yang Hansen enters the game for Donovan Clingan,9,12,Trail Blazers
7:53,Jerami Grant enters the game for Shaedon Sharpe,9,12,Trail Blazers
7:47,Derrick Jones Jr. shooting foul,9,12,Clippers
7:47,Yang Hansen makes free throw 1 of 2,10,12,Trail Blazers
7:47,Yang Hansen makes free throw 2 of 2,11,12,Trail Blazers
7:35,Kawhi Leonard misses 14-foot pullup jump shot,11,12,Clippers
7:32,Derrick Jones Jr. offensive rebound,11,12,Clippers
7:31,Derrick Jones Jr. makes tip shot,11,14,Clippers
7:21,Jrue Holiday steps out of bounds turnover,11,14,Trail Blazers
7:13,James Harden misses 30-foot three point jumper,11,14,Clippers
7:09,Toumani Camara defensive rebound,11,14,Trail Blazers
7:01,Jerami Grant misses 13-foot pullup jump shot,11,14,Trail Blazers
6:59,Ivica Zubac defensive rebound,11,14,Clippers
6:54,Ivica Zubac offensive foul,11,14,Clippers
6:54,Ivica Zubac turnover,11,14,Clippers
6:54,Clippers Full timeout,11,14,Clippers
6:42,Jrue Holiday makes 26-foot three pointer,14,14,Trail Blazers
6:17,James Harden misses driving floating jump shot,14,14,Clippers
6:17,Trail Blazers defensive team rebound,14,14,Trail Blazers
6:17,Trail Blazers Full timeout,14,14,Trail Blazers
6:17,(06:17) [Trail Blazers] COACH'S CHALLENGE (CALL OVERTURNED) [Trail Blazers] retain their timeout,14,14,Trail Blazers
6:06,Deni Avdija misses 8-foot two point shot,14,14,Trail Blazers
6:06,Clippers defensive team rebound,14,14,Clippers
6:06,Yang Hansen loose ball foul,14,14,Trail Blazers
5:43,Kawhi Leonard makes 18-foot jumper (James Harden assists),14,16,Clippers
5:33,Jrue Holiday makes 11-foot pullup jump shot (Toumani Camara assists),16,16,Trail Blazers
5:19,Kawhi Leonard makes 25-foot three pointer,16,19,Clippers
5:01,Jerami Grant misses 27-foot three point jumper,16,19,Trail Blazers
4:59,Derrick Jones Jr. defensive rebound,16,19,Clippers
4:47,Kawhi Leonard misses 14-foot pullup jump shot,16,19,Clippers
4:45,Ivica Zubac offensive rebound,16,19,Clippers
4:38,Ivica Zubac makes layup (Kawhi Leonard assists),16,21,Clippers
4:26,Yang Hansen misses 25-foot three point jumper,16,21,Trail Blazers
4:22,Kawhi Leonard defensive rebound,16,21,Clippers
4:09,Bogdan Bogdanovic bad pass (Deni Avdija steals),16,21,Clippers
4:05,Deni Avdija makes two point shot,18,21,Trail Blazers
4:04,Clippers Full timeout,18,21,Clippers
4:04,Nicolas Batum enters the game for Kawhi Leonard,18,21,Clippers
4:04,John Collins enters the game for Bogdan Bogdanovic,18,21,Clippers
4:04,Blake Wesley enters the game for Jrue Holiday,18,21,Trail Blazers
4:04,Shaedon Sharpe enters the game for Deni Avdija,18,21,Trail Blazers
4:04,Kris Murray enters the game for Toumani Camara,18,21,Trail Blazers
3:47,James Harden makes driving layup,18,23,Clippers
3:33,Blake Wesley misses 14-foot pullup jump shot,18,23,Trail Blazers
3:33,Yang Hansen offensive rebound,18,23,Trail Blazers
3:33,Nicolas Batum personal foul,18,23,Clippers
3:33,Kris Dunn enters the game for Derrick Jones Jr.,18,23,Clippers
3:33,Brook Lopez enters the game for Ivica Zubac,18,23,Clippers
3:33,Donovan Clingan enters the game for Yang Hansen,18,23,Trail Blazers
3:19,Shaedon Sharpe misses 25-foot three point step back jumpshot,18,23,Trail Blazers
3:16,Brook Lopez defensive rebound,18,23,Clippers
3:05,John Collins makes finger roll layup,18,25,Clippers
2:56,Shaedon Sharpe lost ball turnover (James Harden steals),18,25,Trail Blazers
2:54,John Collins makes 2-foot dunk (James Harden assists),18,27,Clippers
2:54,Trail Blazers Full timeout,18,27,Trail Blazers
2:45,Kris Dunn personal foul,18,27,Clippers
2:36,Shaedon Sharpe bad pass (Nicolas Batum steals),18,27,Trail Blazers
2:32,James Harden bad pass (Blake Wesley steals),18,27,Clippers
2:28,Shaedon Sharpe misses 26-foot three point shot,18,27,Trail Blazers
2:27,Donovan Clingan offensive rebound,18,27,Trail Blazers
2:27,Nicolas Batum blocks Donovan Clingan 's 3-foot two point shot,18,27,Trail Blazers
2:27,Jerami Grant offensive rebound,18,27,Trail Blazers
2:27,Brook Lopez shooting foul,18,27,Clippers
2:27,Jerami Grant makes free throw 1 of 2,19,27,Trail Blazers
2:27,Jerami Grant makes free throw 2 of 2,20,27,Trail Blazers
2:06,Brook Lopez misses 27-foot three point pullup jump shot,20,27,Clippers
2:03,John Collins offensive rebound,20,27,Clippers
2:03,John Collins makes tip shot,20,29,Clippers
1:46,John Collins shooting foul,20,27,Clippers
1:46,Jerami Grant makes free throw 1 of 2,21,27,Trail Blazers
1:46,Jerami Grant makes free throw 2 of 2,22,29,Trail Blazers
1:22,Brook Lopez makes 27-foot three point jumper (James Harden assists),22,32,Clippers
1:04,Brook Lopez defensive 3-seconds (technical foul),22,32,Clippers
1:04,Jerami Grant makes technical free throw,23,32,Trail Blazers
1:04,Matisse Thybulle enters the game for Jerami Grant,23,32,Trail Blazers
59.7,Brook Lopez blocks Shaedon Sharpe 's 4-foot dunk,23,32,Trail Blazers
59.7,Brook Lopez defensive rebound,23,32,Clippers
59.7,Matisse Thybulle personal foul,23,32,Trail Blazers
40.1,Matisse Thybulle shooting foul,23,32,Trail Blazers
40.1,James Harden makes free throw 1 of 2,23,33,Clippers
40.1,James Harden makes free throw 2 of 2,23,34,Clippers
32.2,Shaedon Sharpe misses 25-foot three point pullup jump shot,23,34,Trail Blazers
28.4,John Collins defensive rebound,23,34,Clippers
15.6,Brook Lopez misses 29-foot three point jumper,23,34,Clippers
13.6,Trail Blazers defensive team rebound,23,34,Trail Blazers
2.5,Donovan Clingan misses 23-foot three point jumper,23,34,Trail Blazers
2.5,Nicolas Batum defensive rebound,23,34,Clippers
0.0,End of the 1st Quarter,23,34,Unknown
,[ QUARTER 1 ENDED ],,,
12:00,Kawhi Leonard enters the game for James Harden,23,34,Clippers
12:00,Chris Paul enters the game for Nicolas Batum,23,34,Clippers
12:00,Jrue Holiday enters the game for Blake Wesley,23,34,Trail Blazers
12:00,Deni Avdija enters the game for Shaedon Sharpe,23,34,Trail Blazers
12:00,Jerami Grant enters the game for Donovan Clingan,23,34,Trail Blazers
12:00,Toumani Camara enters the game for Kris Murray,23,34,Trail Blazers
11:42,John Collins lost ball turnover (Jerami Grant steals),23,34,Clippers
11:38,Matisse Thybulle makes 25-foot running pullup jump shot (Jrue Holiday assists),26,34,Trail Blazers
11:16,John Collins makes 5-foot two point shot (Kris Dunn assists),26,36,Clippers
11:10,John Collins personal foul,26,36,Clippers
11:02,Jerami Grant misses dunk,26,36,Trail Blazers
10:59,John Collins defensive rebound,26,36,Clippers
10:55,John Collins bad pass (Matisse Thybulle steals),26,36,Clippers
10:50,Jerami Grant misses 27-foot three point jumper,26,36,Trail Blazers
10:48,Kris Dunn defensive rebound,26,36,Clippers
10:23,Kris Dunn misses 26-foot three point jumper,26,36,Clippers
10:21,Deni Avdija defensive rebound,26,36,Trail Blazers
10:16,Jerami Grant makes 25-foot three point shot (Deni Avdija assists),29,36,Trail Blazers
9:51,John Collins misses two point shot,29,36,Clippers
9:47,Toumani Camara defensive rebound,29,36,Trail Blazers
9:44,Kris Dunn shooting foul,29,36,Clippers
9:44,Jrue Holiday makes free throw 1 of 2,30,36,Trail Blazers
9:44,Ivica Zubac enters the game for Brook Lopez,30,36,Clippers
9:44,Jrue Holiday makes free throw 2 of 2,31,36,Trail Blazers
9:22,Chris Paul misses 28-foot three point jumper,31,36,Clippers
9:21,Clippers offensive team rebound,31,36,Clippers
9:21,Matisse Thybulle loose ball foul,31,36,Trail Blazers
9:09,Kris Dunn makes 11-foot driving floating jump shot (Chris Paul assists),31,38,Clippers
9:04,Chris Paul shooting foul,31,38,Clippers
9:04,Jrue Holiday makes free throw 1 of 2,32,38,Trail Blazers
9:04,Kris Murray enters the game for Matisse Thybulle,32,38,Trail Blazers
9:04,Jrue Holiday misses free throw 2 of 2,32,38,Trail Blazers
9:01,John Collins defensive rebound,32,38,Clippers
8:51,Kris Dunn out of bounds bad pass turnover,32,38,Clippers
8:31,Deni Avdija misses 24-foot three point jumper,32,38,Trail Blazers
8:29,Kris Dunn defensive rebound,32,38,Clippers
8:25,Clippers Full timeout,32,38,Clippers
8:13,Kawhi Leonard makes 13-foot two point shot,32,40,Clippers
8:02,Deni Avdija misses driving layup,32,40,Trail Blazers
8:00,Kawhi Leonard defensive rebound,32,40,Clippers
7:54,Kris Dunn makes 6-foot driving floating jump shot (Chris Paul assists),32,42,Clippers
7:40,Deni Avdija makes 26-foot three point jumper (Kris Murray assists),35,42,Trail Blazers
7:18,Kawhi Leonard misses 21-foot pullup jump shot,35,42,Clippers
7:15,Kris Murray defensive rebound,35,42,Trail Blazers
7:14,Deni Avdija makes 5-foot driving floating jump shot (Jrue Holiday assists),37,42,Trail Blazers
7:14,Kris Dunn shooting foul,37,42,Clippers
7:14,James Harden enters the game for Kris Dunn,37,42,Clippers
7:14,Donovan Clingan enters the game for Jrue Holiday,37,42,Trail Blazers
7:14,Blake Wesley enters the game for Jerami Grant,37,42,Trail Blazers
7:14,Deni Avdija makes free throw 1 of 1,38,42,Trail Blazers
7:09,Blake Wesley personal foul,38,42,Trail Blazers
7:00,Toumani Camara personal foul,38,42,Trail Blazers
7:00,Shaedon Sharpe enters the game for Toumani Camara,38,42,Trail Blazers
6:46,Kawhi Leonard bad pass (Kris Murray steals),38,42,Clippers
6:37,Chris Paul personal foul,38,42,Clippers
6:37,Deni Avdija makes free throw 1 of 2,39,42,Trail Blazers
6:37,Derrick Jones Jr. enters the game for Chris Paul,39,42,Clippers
6:37,Nicolas Batum enters the game for John Collins,39,42,Clippers
6:37,Deni Avdija makes free throw 2 of 2,40,42,Trail Blazers
6:24,Kawhi Leonard misses 17-foot pullup jump shot,40,42,Clippers
6:22,Blake Wesley defensive rebound,40,42,Trail Blazers
6:07,Shaedon Sharpe misses driving layup,40,42,Trail Blazers
6:04,Donovan Clingan offensive rebound,40,42,Trail Blazers
6:04,Donovan Clingan makes tip shot,42,42,Trail Blazers
6:01,James Harden lost ball turnover (Blake Wesley steals),42,42,Clippers
6:01,Blake Wesley makes two point shot,44,42,Trail Blazers
6:01,James Harden shooting foul,44,42,Clippers
6:01,Bogdan Bogdanovic enters the game for Kawhi Leonard,44,42,Clippers
6:01,Matisse Thybulle enters the game for Deni Avdija,44,42,Trail Blazers
6:01,Blake Wesley misses free throw 1 of 1,44,42,Trail Blazers
6:00,Trail Blazers offensive team rebound,44,42,Trail Blazers
5:50,Derrick Jones Jr. blocks Shaedon Sharpe 's 1-foot driving dunk,44,42,Trail Blazers
5:47,James Harden defensive rebound,44,42,Clippers
5:41,Nicolas Batum misses 25-foot three point jumper,44,42,Clippers
5:38,Donovan Clingan defensive rebound,44,42,Trail Blazers
5:36,James Harden shooting foul,44,42,Clippers
5:36,Blake Wesley makes free throw 1 of 2,45,42,Trail Blazers
5:36,Blake Wesley makes free throw 2 of 2,46,42,Trail Blazers
5:25,Derrick Jones Jr. offensive foul,46,42,Clippers
5:25,Derrick Jones Jr. turnover,46,42,Clippers
5:21,Blake Wesley offensive foul,46,42,Trail Blazers
5:21,Blake Wesley turnover,46,42,Trail Blazers
5:04,Ivica Zubac makes 4-foot dunk (James Harden assists),46,44,Clippers
4:55,Shaedon Sharpe out of bounds lost ball turnover,46,44,Trail Blazers
4:44,Blake Wesley personal foul,46,44,Trail Blazers
4:37,Bogdan Bogdanovic out of bounds lost ball turnover,46,44,Clippers
4:31,Donovan Clingan makes 26-foot three point jumper (Blake Wesley assists),49,44,Trail Blazers
4:29,Clippers Full timeout,49,44,Clippers
4:29,Kawhi Leonard enters the game for Nicolas Batum,49,44,Clippers
4:29,Jrue Holiday enters the game for Kris Murray,49,44,Trail Blazers
4:18,Derrick Jones Jr. lost ball turnover (Shaedon Sharpe steals),49,44,Clippers
4:17,Derrick Jones Jr. shooting foul,49,44,Clippers
4:17,Shaedon Sharpe makes free throw 1 of 2,50,44,Trail Blazers
4:17,Shaedon Sharpe makes free throw 2 of 2,51,44,Trail Blazers
4:05,James Harden misses 27-foot three point jumper,51,44,Clippers
4:02,Blake Wesley defensive rebound,51,44,Trail Blazers
3:55,Jrue Holiday misses driving layup,51,44,Trail Blazers
3:53,Ivica Zubac defensive rebound,51,44,Clippers
3:38,James Harden misses 27-foot three point pullup jump shot,51,44,Clippers
3:35,Donovan Clingan defensive rebound,51,44,Trail Blazers
3:25,Jrue Holiday misses 26-foot three point step back jumpshot,51,44,Trail Blazers
3:22,Donovan Clingan offensive rebound,51,44,Trail Blazers
3:18,Shaedon Sharpe misses 5-foot two point shot,51,44,Trail Blazers
3:15,Donovan Clingan offensive rebound,51,44,Trail Blazers
3:14,Shaedon Sharpe makes 1-foot two point shot (Donovan Clingan assists),53,44,Trail Blazers
3:02,Kawhi Leonard misses 17-foot two point shot,53,44,Clippers
2:58,Blake Wesley defensive rebound,53,44,Trail Blazers
2:54,Blake Wesley misses running pullup jump shot,53,44,Trail Blazers
2:52,Kawhi Leonard defensive rebound,53,44,Clippers
2:44,Kawhi Leonard misses driving floating jump shot,53,44,Clippers
2:41,Blake Wesley defensive rebound,53,44,Trail Blazers
2:39,Shaedon Sharpe makes 1-foot dunk (Blake Wesley assists),55,44,Trail Blazers
2:19,Ivica Zubac makes 10-foot two point shot,55,46,Clippers
2:01,Jrue Holiday makes 25-foot three point step back jumpshot (Blake Wesley assists),58,46,Trail Blazers
1:48,Matisse Thybulle personal foul,58,46,Trail Blazers
1:48,Kawhi Leonard makes free throw 1 of 2,58,47,Clippers
1:48,Jerami Grant enters the game for Blake Wesley,58,47,Trail Blazers
1:48,Deni Avdija enters the game for Matisse Thybulle,58,47,Trail Blazers
1:48,Kawhi Leonard makes free throw 2 of 2,58,48,Clippers
1:48,Toumani Camara enters the game for Donovan Clingan,58,48,Trail Blazers
1:33,Jrue Holiday misses 25-foot three point step back jumpshot,58,48,Trail Blazers
1:30,Bogdan Bogdanovic defensive rebound,58,48,Clippers
1:20,Ivica Zubac makes 4-foot two point shot (James Harden assists),58,50,Clippers
1:06,Deni Avdija misses 26-foot three point step back jumpshot,58,50,Trail Blazers
1:02,Jrue Holiday offensive rebound,58,50,Trail Blazers
1:00,Toumani Camara makes alley oop layup (Jrue Holiday assists),60,50,Trail Blazers
42.3,Kawhi Leonard misses driving floating jump shot,60,50,Clippers
42.3,Clippers offensive team rebound,60,50,Clippers
42.3,Jerami Grant loose ball foul,60,50,Trail Blazers
42.3,Ivica Zubac makes free throw 1 of 2,60,51,Clippers
42.3,Nicolas Batum enters the game for Derrick Jones Jr.,60,51,Clippers
42.3,Ivica Zubac makes free throw 2 of 2,60,52,Clippers
30.9,Deni Avdija misses driving layup,60,52,Trail Blazers
27.8,Nicolas Batum defensive rebound,60,52,Clippers
12.9,Nicolas Batum makes 23-foot three point jumper (James Harden assists),60,55,Clippers
0.6,Deni Avdija lost ball turnover (Nicolas Batum steals),60,55,Trail Blazers
0.0,(00:00) [Trail Blazers] REF-INITIATED REVIEW (REPLAY SUPPORTS CALL),60,55,Unknown
0.0,End of the 2nd Quarter,60,55,Unknown
,[ QUARTER 2 ENDED ],,,
12:00,Derrick Jones Jr. enters the game for Bogdan Bogdanovic,60,55,Clippers
12:00,Kris Dunn enters the game for Nicolas Batum,60,55,Clippers
12:00,Donovan Clingan enters the game for Jerami Grant,60,55,Trail Blazers
11:52,James Harden offensive foul,60,55,Clippers
11:52,James Harden turnover,60,55,Clippers
11:34,Jrue Holiday makes 25-foot three point jumper (Deni Avdija assists),63,55,Trail Blazers
11:22,Deni Avdija personal foul,63,55,Trail Blazers
11:12,Ivica Zubac makes layup (James Harden assists),63,57,Clippers
10:54,Shaedon Sharpe makes 26-foot three point jumper,66,57,Trail Blazers
10:35,Kris Dunn makes driving layup (James Harden assists),66,59,Clippers
10:35,Donovan Clingan inbound turnover,66,59,Trail Blazers
10:26,Kawhi Leonard makes 25-foot three point jumper (James Harden assists),66,62,Clippers
10:17,Shaedon Sharpe bad pass (James Harden steals),66,62,Trail Blazers
9:59,Derrick Jones Jr. misses 27-foot three point jumper,66,62,Clippers
9:57,Deni Avdija defensive rebound,66,62,Trail Blazers
9:39,Deni Avdija misses driving layup,66,62,Trail Blazers
9:37,Donovan Clingan offensive rebound,66,62,Trail Blazers
9:34,Shaedon Sharpe makes 4-foot layup (Donovan Clingan assists),68,62,Trail Blazers
9:23,Kawhi Leonard makes 23-foot three point jumper (James Harden assists),68,65,Clippers
9:09,Toumani Camara misses 25-foot three point jumper,68,65,Trail Blazers
9:07,Kawhi Leonard defensive rebound,68,65,Clippers
8:54,Ivica Zubac makes 1-foot dunk (James Harden assists),68,67,Clippers
8:54,Donovan Clingan shooting foul,68,67,Trail Blazers
8:54,Ivica Zubac makes free throw 1 of 1,68,68,Clippers
8:41,Jrue Holiday misses 10-foot two point shot,68,68,Trail Blazers
8:40,Donovan Clingan offensive rebound,68,68,Trail Blazers
8:39,Ivica Zubac shooting foul,68,68,Clippers
8:39,Donovan Clingan makes free throw 1 of 2,69,68,Trail Blazers
8:39,Donovan Clingan makes free throw 2 of 2,70,68,Trail Blazers
8:21,James Harden makes 4-foot driving floating jump shot,70,70,Clippers
8:11,Toumani Camara misses 27-foot three point pullup jump shot,70,70,Trail Blazers
8:08,Shaedon Sharpe offensive rebound,70,70,Trail Blazers
8:05,Toumani Camara makes 3-foot layup (Shaedon Sharpe assists),72,70,Trail Blazers
7:41,Kawhi Leonard makes 25-foot three point step back jumpshot,72,73,Clippers
7:30,Donovan Clingan makes 3-foot alley oop dunk shot (Deni Avdija assists),74,73,Trail Blazers
7:11,Ivica Zubac misses 5-foot two point shot,74,73,Clippers
7:09,Deni Avdija defensive rebound,74,73,Trail Blazers
6:58,Kris Dunn shooting foul,74,73,Clippers
6:58,Clippers Full timeout,74,73,Clippers
6:58,Jerami Grant enters the game for Shaedon Sharpe,74,73,Trail Blazers
6:58,Kris Murray enters the game for Donovan Clingan,74,73,Trail Blazers
6:58,Deni Avdija makes free throw 1 of 2,75,73,Trail Blazers
6:58,Deni Avdija misses free throw 2 of 2,75,73,Trail Blazers
6:58,Kawhi Leonard defensive rebound,75,73,Clippers
6:33,Kawhi Leonard misses 27-foot three point step back jumpshot,75,73,Clippers
6:31,Jrue Holiday defensive rebound,75,73,Trail Blazers
6:11,Toumani Camara misses two point shot,75,73,Trail Blazers
6:10,James Harden defensive rebound,75,73,Clippers
6:03,Kris Dunn makes 24-foot three point jumper (Ivica Zubac assists),75,76,Clippers
5:55,Kawhi Leonard shooting foul,75,76,Clippers
5:55,Jerami Grant misses free throw 1 of 2,75,76,Trail Blazers
5:55,Trail Blazers offensive team rebound,75,76,Trail Blazers
5:55,Jerami Grant makes free throw 2 of 2,76,76,Trail Blazers
5:33,Kawhi Leonard misses 13-foot two point shot,76,76,Clippers
5:31,Kris Murray defensive rebound,76,76,Trail Blazers
5:17,Kris Murray misses 26-foot three point jumper,76,76,Trail Blazers
5:14,James Harden defensive rebound,76,76,Clippers
5:02,Toumani Camara shooting foul,76,76,Trail Blazers
5:02,James Harden makes free throw 1 of 2,76,77,Clippers
5:02,Nicolas Batum enters the game for Kawhi Leonard,76,77,Clippers
5:02,John Collins enters the game for Kris Dunn,76,77,Clippers
5:02,Blake Wesley enters the game for Jrue Holiday,76,77,Trail Blazers
5:02,James Harden makes free throw 2 of 2,76,78,Clippers
4:45,Blake Wesley misses 26-foot three point jumper,76,78,Trail Blazers
4:43,Blake Wesley offensive rebound,76,78,Trail Blazers
4:41,Blake Wesley misses 19-foot jumper,76,78,Trail Blazers
4:39,Ivica Zubac defensive rebound,76,78,Clippers
4:28,Ivica Zubac makes 1-foot alley oop dunk shot (James Harden assists),76,80,Clippers
4:11,Deni Avdija lost ball turnover (Derrick Jones Jr. steals),76,80,Trail Blazers
4:07,James Harden misses running pullup jump shot,76,80,Clippers
4:03,Deni Avdija defensive rebound,76,80,Trail Blazers
4:01,Derrick Jones Jr. shooting foul,76,80,Clippers
4:01,Deni Avdija makes free throw 1 of 2,77,80,Trail Blazers
4:01,Bogdan Bogdanovic enters the game for Derrick Jones Jr.,77,80,Clippers
4:01,Matisse Thybulle enters the game for Kris Murray,77,80,Trail Blazers
4:01,Shaedon Sharpe enters the game for Toumani Camara,77,80,Trail Blazers
4:01,Deni Avdija makes free throw 2 of 2,78,80,Trail Blazers
3:43,Ivica Zubac makes 1-foot dunk (Nicolas Batum assists),78,82,Clippers
3:37,Jerami Grant misses driving layup,78,82,Trail Blazers
3:35,James Harden defensive rebound,78,82,Clippers
3:33,James Harden out of bounds bad pass turnover,78,82,Clippers
3:33,Kris Murray enters the game for Deni Avdija,78,82,Trail Blazers
3:21,Jerami Grant misses 27-foot three point jumper,78,82,Trail Blazers
3:18,Ivica Zubac defensive rebound,78,82,Clippers
3:08,Nicolas Batum misses 27-foot three point jumper,78,82,Clippers
3:02,Blake Wesley defensive rebound,78,82,Trail Blazers
2:41,Shaedon Sharpe misses 9-foot two point shot,78,82,Trail Blazers
2:39,Nicolas Batum defensive rebound,78,82,Clippers
2:32,James Harden makes driving layup,78,84,Clippers
2:18,Matisse Thybulle misses 26-foot three point jumper,78,84,Trail Blazers
2:14,Shaedon Sharpe offensive rebound,78,84,Trail Blazers
2:08,Shaedon Sharpe bad pass (John Collins steals),78,84,Trail Blazers
1:55,Bogdan Bogdanovic steps out of bounds turnover,78,84,Clippers
1:55,Trail Blazers Full timeout,78,84,Trail Blazers
1:55,Donovan Clingan enters the game for Kris Murray,78,84,Trail Blazers
1:44,Shaedon Sharpe misses 26-foot three point jumper,78,84,Trail Blazers
1:40,Bogdan Bogdanovic defensive rebound,78,84,Clippers
1:26,Bogdan Bogdanovic bad pass (Donovan Clingan steals),78,84,Clippers
1:20,Nicolas Batum blocks Shaedon Sharpe 's 7-foot two point shot,78,84,Trail Blazers
1:17,Jerami Grant offensive rebound,78,84,Trail Blazers
1:09,Shaedon Sharpe out of bounds bad pass turnover,78,84,Trail Blazers
1:08,Brook Lopez enters the game for Ivica Zubac,78,84,Clippers
1:00,Shaedon Sharpe personal foul,78,84,Trail Blazers
1:00,Jrue Holiday enters the game for Blake Wesley,78,84,Trail Blazers
49.0,James Harden makes 27-foot three point step back jumpshot,78,87,Clippers
38.0,Jerami Grant makes 3-foot two point shot (Jrue Holiday assists),80,87,Trail Blazers
23.4,James Harden lost ball turnover,80,87,Clippers
23.4,Brook Lopez loose ball foul,80,87,Clippers
23.4,Shaedon Sharpe makes free throw 1 of 2,81,87,Trail Blazers
23.4,Shaedon Sharpe makes free throw 2 of 2,82,87,Trail Blazers
5.2,James Harden lost ball turnover (Shaedon Sharpe steals),82,87,Clippers
1.3,Brook Lopez blocks Shaedon Sharpe's dunk,82,87,Trail Blazers
1.0,Clippers defensive team rebound,82,87,Clippers
0.0,End of the 3rd Quarter,82,87,Unknown
,[ QUARTER 3 ENDED ],,,
12:00,Kawhi Leonard enters the game for James Harden,82,87,Clippers
12:00,Chris Paul enters the game for Nicolas Batum,82,87,Clippers
12:00,Toumani Camara enters the game for Matisse Thybulle,82,87,Trail Blazers
12:00,Blake Wesley enters the game for Jerami Grant,82,87,Trail Blazers
12:00,Kris Murray enters the game for Shaedon Sharpe,82,87,Trail Blazers
11:46,Blake Wesley makes 19-foot pullup jump shot,84,87,Trail Blazers
11:24,Bogdan Bogdanovic misses 26-foot three point jumper,84,87,Clippers
11:21,Bogdan Bogdanovic offensive rebound,84,87,Clippers
11:19,Bogdan Bogdanovic misses 16-foot two point shot,84,87,Clippers
11:15,Donovan Clingan defensive rebound,84,87,Trail Blazers
11:05,Donovan Clingan misses 27-foot three point jumper,84,87,Trail Blazers
11:03,Trail Blazers offensive team rebound,84,87,Trail Blazers
10:57,Toumani Camara misses 28-foot three point pullup jump shot,84,87,Trail Blazers
10:53,Jrue Holiday offensive rebound,84,87,Trail Blazers
10:50,Brook Lopez blocks Toumani Camara 's 3-foot layup,84,87,Trail Blazers
10:46,Bogdan Bogdanovic defensive rebound,84,87,Clippers
10:36,Brook Lopez misses 29-foot three point jumper,84,87,Clippers
10:32,Bogdan Bogdanovic offensive rebound,84,87,Clippers
10:32,Jrue Holiday personal foul,84,87,Trail Blazers
10:17,Bogdan Bogdanovic misses 12-foot two point shot,84,87,Clippers
10:15,Jrue Holiday defensive rebound,84,87,Trail Blazers
10:08,Jrue Holiday misses 27-foot three point jumper,84,87,Trail Blazers
