time,description,home_score,away_score,team
12:00,Nic Claxton vs. Ryan Kalkbrenner (Ben Saraf gains possession),0,0,Nets
11:33,Nic Claxton misses 11-foot two point shot,0,0,Nets
11:33,Hornets defensive team rebound,0,0,Hornets
11:18,Cam Thomas shooting foul,0,0,Nets
11:18,Miles Bridges makes free throw 1 of 2,0,1,Hornets
11:18,Miles Bridges misses free throw 2 of 2,0,1,Hornets
11:15,Ben Saraf defensive rebound,0,1,Nets
11:04,Terance Mann misses 23-foot three point step back jumpshot,0,1,Nets
11:01,Kon Knueppel defensive rebound,0,1,Hornets
10:56,Kon Knueppel makes two point shot,0,3,Hornets
10:43,Brandon Miller personal foul,0,3,Hornets
10:34,Cam Thomas misses two point shot,0,3,Nets
10:32,Ryan Kalkbrenner defensive rebound,0,3,Hornets
10:28,Brandon Miller misses running pullup jump shot,0,3,Hornets
10:27,Miles Bridges offensive rebound,0,3,Hornets
10:27,Terance Mann shooting foul,0,3,Nets
10:27,Miles Bridges makes free throw 1 of 2,0,4,Hornets
10:27,Miles Bridges makes free throw 2 of 2,0,5,Hornets
10:12,Nic Claxton makes driving layup (Ben Saraf assists),2,5,Nets
10:04,Michael Porter Jr. personal foul,2,5,Nets
9:58,Ryan Kalkbrenner out of bounds bad pass turnover,2,5,Hornets
9:43,Michael Porter Jr. misses 24-foot three point jumper,2,5,Nets
9:40,Miles Bridges defensive rebound,2,5,Hornets
9:36,Brandon Miller makes 2-foot dunk (LaMelo Ball assists),2,7,Hornets
9:25,Ben Saraf makes driving layup,4,7,Nets
9:18,LaMelo Ball misses 25-foot three point jumper,4,7,Hornets
9:15,Miles Bridges offensive rebound,4,7,Hornets
9:11,Ryan Kalkbrenner 3 second turnover,4,7,Hornets
8:58,Ryan Kalkbrenner blocks Nic Claxton 's 9-foot two point shot,4,7,Nets
8:57,Nets offensive team rebound,4,7,Nets
8:54,Michael Porter Jr. makes 15-foot pullup jump shot,6,7,Nets
8:41,LaMelo Ball makes 28-foot three point jumper (Brandon Miller assists),6,10,Hornets
8:28,Michael Porter Jr. makes 24-foot three point step back jumpshot (Ben Saraf assists),9,10,Nets
8:16,Brandon Miller misses 26-foot three point jumper,9,10,Hornets
8:13,Ben Saraf defensive rebound,9,10,Nets
8:11,Terance Mann steps out of bounds turnover,9,10,Nets
7:53,LaMelo Ball misses driving floating jump shot,9,10,Hornets
7:51,Ben Saraf defensive rebound,9,10,Nets
7:43,Michael Porter Jr. misses driving layup,9,10,Nets
7:43,Nets offensive team rebound,9,10,Nets
7:43,Brandon Miller loose ball foul,9,10,Hornets
7:43,Collin Sexton enters the game for Brandon Miller,9,10,Hornets
7:29,Nic Claxton makes layup (Michael Porter Jr. assists),11,10,Nets
7:22,Cam Thomas personal foul,11,10,Nets
7:19,Ben Saraf shooting foul,11,10,Nets
7:19,Collin Sexton makes free throw 1 of 2,11,11,Hornets
7:19,Collin Sexton makes free throw 2 of 2,11,12,Hornets
7:08,Michael Porter Jr. makes 25-foot three point jumper (Ben Saraf assists),14,12,Nets
7:08,Hornets Full timeout,14,12,Hornets
7:08,Sion James enters the game for Kon Knueppel,14,12,Hornets
6:52,Ryan Kalkbrenner makes 2-foot layup (Collin Sexton assists),14,14,Hornets
6:40,Nic Claxton misses driving layup,14,14,Nets
6:35,Terance Mann offensive rebound,14,14,Nets
6:35,Terance Mann makes tip shot,16,14,Nets
6:31,Ryan Kalkbrenner makes layup (Miles Bridges assists),16,16,Hornets
6:17,Cam Thomas makes 5-foot driving floating jump shot (Nic Claxton assists),18,16,Nets
6:03,Cam Thomas blocks LaMelo Ball 's 7-foot two point shot,18,16,Hornets
5:59,LaMelo Ball offensive rebound,18,16,Hornets
5:58,Ryan Kalkbrenner makes 3-foot dunk (LaMelo Ball assists),18,18,Hornets
5:44,Sion James blocks Michael Porter Jr. 's 3-foot layup,18,18,Nets
5:41,Sion James defensive rebound,18,18,Hornets
5:34,LaMelo Ball misses driving floating jump shot,18,18,Hornets
5:32,Ryan Kalkbrenner offensive rebound,18,18,Hornets
5:29,Collin Sexton misses 20-foot step back jumpshot,18,18,Hornets
5:26,Nic Claxton defensive rebound,18,18,Nets
5:18,Ryan Kalkbrenner shooting foul,18,18,Hornets
5:18,Michael Porter Jr. misses free throw 1 of 2,18,18,Nets
5:18,Nets offensive team rebound,18,18,Nets
5:18,Moussa Diabate enters the game for Ryan Kalkbrenner,18,18,Hornets
5:18,Ziaire Williams enters the game for Terance Mann,18,18,Nets
5:18,Egor Demin enters the game for Nic Claxton,18,18,Nets
5:18,Day'Ron Sharpe enters the game for Ben Saraf,18,18,Nets
5:18,Michael Porter Jr. misses free throw 2 of 2,18,18,Nets
5:14,Sion James defensive rebound,18,18,Hornets
5:05,Miles Bridges misses driving floating jump shot,18,18,Hornets
5:03,Day'Ron Sharpe defensive rebound,18,18,Nets
4:58,Collin Sexton shooting foul,18,18,Hornets
4:58,Cam Thomas makes free throw 1 of 3,19,18,Nets
4:58,Cam Thomas makes free throw 2 of 3,20,18,Nets
4:58,Tidjane Salaun enters the game for Miles Bridges,20,18,Hornets
4:58,Noah Clowney enters the game for Michael Porter Jr.,20,18,Nets
4:58,Cam Thomas makes free throw 3 of 3,21,18,Nets
4:37,Tidjane Salaun misses 3-foot two point shot,21,18,Hornets
4:36,Moussa Diabate offensive rebound,21,18,Hornets
4:34,LaMelo Ball misses 24-foot three point jumper,21,18,Hornets
4:31,Sion James offensive rebound,21,18,Hornets
4:29,Sion James makes 2-foot driving dunk,21,20,Hornets
4:28,Nets Full timeout,21,20,Nets
4:15,Sion James shooting foul,21,20,Hornets
4:15,Cam Thomas makes free throw 1 of 2,22,20,Nets
4:15,Cam Thomas misses free throw 2 of 2,22,20,Nets
4:12,Moussa Diabate defensive rebound,22,20,Hornets
4:01,LaMelo Ball makes driving layup,22,22,Hornets
3:42,Cam Thomas misses 18-foot jumper,22,22,Nets
3:42,Nets offensive team rebound,22,22,Nets
3:42,Moussa Diabate loose ball foul,22,22,Hornets
3:42,Day'Ron Sharpe makes free throw 1 of 2,23,22,Nets
3:42,Tyrese Martin enters the game for Cam Thomas,23,22,Nets
3:42,Day'Ron Sharpe misses free throw 2 of 2,23,22,Nets
3:38,Collin Sexton defensive rebound,23,22,Hornets
3:33,Collin Sexton makes two point shot,23,24,Hornets
3:23,Ziaire Williams misses 28-foot three point jumper,23,24,Nets
3:20,Hornets defensive team rebound,23,24,Hornets
3:05,Collin Sexton misses 7-foot two point shot,23,24,Hornets
3:03,Ziaire Williams defensive rebound,23,24,Nets
2:48,Day'Ron Sharpe makes layup (Tyrese Martin assists),25,24,Nets
2:39,Collin Sexton makes 23-foot three point jumper (LaMelo Ball assists),25,27,Hornets
2:25,Tidjane Salaun personal foul,25,27,Hornets
2:25,Egor Demin makes free throw 1 of 2,26,27,Nets
2:25,Kon Knueppel enters the game for LaMelo Ball,26,27,Hornets
2:25,Tre Mann enters the game for Sion James,26,27,Hornets
2:25,Egor Demin makes free throw 2 of 2,27,27,Nets
2:11,Moussa Diabate makes 7-foot hook shot (Tre Mann assists),27,29,Hornets
1:57,Day'Ron Sharpe makes layup (Egor Demin assists),29,29,Nets
1:46,Kon Knueppel makes 26-foot three point jumper (Tre Mann assists),29,32,Hornets
1:30,Noah Clowney misses driving layup,29,32,Nets
1:27,Kon Knueppel defensive rebound,29,32,Hornets
1:24,Moussa Diabate traveling,29,32,Hornets
1:11,Day'Ron Sharpe bad pass (Tre Mann steals),29,32,Nets
1:08,Moussa Diabate makes two point shot (Tre Mann assists),29,34,Hornets
1:07,Nets Full timeout,29,34,Nets
58.4,Egor Demin lost ball turnover (Collin Sexton steals),29,34,Nets
55.2,Tre Mann makes two point shot,29,36,Hornets
55.1,Day'Ron Sharpe makes 1-foot dunk (Ziaire Williams assists),31,36,Nets
51.9,Egor Demin shooting foul,31,36,Nets
51.9,Collin Sexton makes free throw 1 of 2,31,37,Hornets
51.9,Miles Bridges enters the game for Tidjane Salaun,31,37,Hornets
51.9,Collin Sexton makes free throw 2 of 2,31,38,Hornets
39.8,Day'Ron Sharpe offensive foul,31,38,Nets
39.8,Day'Ron Sharpe turnover,31,38,Nets
28.1,Tre Mann bad pass (Tyrese Martin steals),31,38,Hornets
24.0,Tyrese Martin lost ball turnover (Moussa Diabate steals),31,38,Nets
9.0,Kon Knueppel traveling,31,38,Hornets
9.0,Cam Thomas enters the game for Egor Demin,31,38,Nets
3.4,Kon Knueppel personal foul,31,38,Hornets
3.4,Nets Coach's Challenge,31,38,Nets
3.4,(00:03.4) [Nets] COACH'S CHALLENGE (CALL OVERTURNED) [Nets] retain their timeout,31,38,Nets
3.4,Ziaire Williams makes free throw 1 of 2,32,38,Nets
3.4,Ziaire Williams misses free throw 2 of 2,32,38,Nets
3.4,Miles Bridges defensive rebound,32,38,Hornets
0.2,Miles Bridges misses heave jump shot,32,38,Hornets
0.1,Hornets offensive team rebound,32,38,Hornets
0.0,End of the 1st Quarter,32,38,Unknown
,[ QUARTER 1 ENDED ],,,
12:00,Brandon Miller enters the game for Collin Sexton,32,38,Hornets
12:00,Ryan Kalkbrenner enters the game for Moussa Diabate,32,38,Hornets
12:00,Michael Porter Jr. enters the game for Ziaire Williams,32,38,Nets
12:00,Egor Demin enters the game for Day'Ron Sharpe,32,38,Nets
12:00,Nic Claxton enters the game for Cam Thomas,32,38,Nets
11:39,Miles Bridges makes 22-foot three point jumper (Brandon Miller assists),32,41,Hornets
11:20,Miles Bridges personal foul,32,41,Hornets
11:13,Egor Demin makes 25-foot three point step back jumpshot,35,41,Nets
11:00,Brandon Miller misses 13-foot step back jumpshot,35,41,Hornets
10:57,Michael Porter Jr. defensive rebound,35,41,Nets
10:46,Michael Porter Jr. misses 24-foot three point pullup jump shot,35,41,Nets
10:41,Tyrese Martin offensive rebound,35,41,Nets
10:37,Tyrese Martin misses 22-foot three point jumper,35,41,Nets
10:35,Noah Clowney offensive rebound,35,41,Nets
10:35,Kon Knueppel personal foul,35,41,Hornets
10:35,Sion James enters the game for Kon Knueppel,35,41,Hornets
10:29,Nic Claxton makes layup (Tyrese Martin assists),37,41,Nets
10:29,Sion James shooting foul,37,41,Hornets
10:29,Nic Claxton misses free throw 1 of 1,37,41,Nets
10:26,Miles Bridges defensive rebound,37,41,Hornets
10:16,Miles Bridges misses 23-foot three point jumper,37,41,Hornets
10:16,Nic Claxton defensive rebound,37,41,Nets
10:06,Nic Claxton makes driving layup (Tyrese Martin assists),39,41,Nets
10:06,Ryan Kalkbrenner shooting foul,39,41,Hornets
10:06,Nic Claxton makes free throw 1 of 1,40,41,Nets
9:43,Brandon Miller makes 26-foot three point step back jumpshot (Ryan Kalkbrenner assists),40,44,Hornets
9:27,Michael Porter Jr. misses driving floating jump shot,40,44,Nets
9:24,Nic Claxton offensive rebound,40,44,Nets
9:24,Nic Claxton makes tip shot,42,44,Nets
9:13,Michael Porter Jr. shooting foul,42,44,Nets
9:13,Moussa Diabate enters the game for Ryan Kalkbrenner,42,44,Hornets
9:13,Tre Mann makes free throw 1 of 2,42,45,Hornets
9:13,Tidjane Salaun enters the game for Miles Bridges,42,45,Hornets
9:13,Tre Mann makes free throw 2 of 2,42,46,Hornets
8:59,Michael Porter Jr. misses 24-foot three point jumper,42,46,Nets
8:58,Hornets defensive team rebound,42,46,Hornets
8:51,Noah Clowney personal foul,42,46,Nets
8:39,Brandon Miller misses 29-foot three point jumper,42,46,Hornets
8:36,Egor Demin defensive rebound,42,46,Nets
8:31,Egor Demin misses 27-foot three point jumper,42,46,Nets
8:28,Hornets defensive team rebound,42,46,Hornets
8:16,Moussa Diabate makes 10-foot two point shot (Brandon Miller assists),42,48,Hornets
7:57,Noah Clowney misses driving layup,42,48,Nets
7:55,Moussa Diabate defensive rebound,42,48,Hornets
7:48,Tidjane Salaun makes 28-foot three point jumper (Sion James assists),42,51,Hornets
7:40,Nets Full timeout,42,51,Nets
7:40,LaMelo Ball enters the game for Tre Mann,42,51,Hornets
7:40,Day'Ron Sharpe enters the game for Egor Demin,42,51,Nets
7:40,Ben Saraf enters the game for Tyrese Martin,42,51,Nets
7:40,Cam Thomas enters the game for Noah Clowney,42,51,Nets
7:40,Terance Mann enters the game for Nic Claxton,42,51,Nets
7:21,Day'Ron Sharpe makes 25-foot three point step back jumpshot (Michael Porter Jr. assists),45,51,Nets
7:01,Brandon Miller makes 22-foot three point jumper (Tidjane Salaun assists),45,54,Hornets
6:43,Cam Thomas makes 4-foot two point shot (Michael Porter Jr. assists),47,54,Nets
6:37,Day'Ron Sharpe shooting foul,47,54,Nets
6:37,Brandon Miller makes free throw 1 of 2,47,55,Hornets
6:37,Tyrese Martin enters the game for Michael Porter Jr.,47,55,Nets
6:37,Brandon Miller makes free throw 2 of 2,47,56,Hornets
6:29,Moussa Diabate shooting foul,47,56,Hornets
6:29,Ben Saraf misses free throw 1 of 2,47,56,Nets
6:29,Nets offensive team rebound,47,56,Nets
6:29,Collin Sexton enters the game for Sion James,47,56,Hornets
6:29,Ben Saraf makes free throw 2 of 2,48,56,Nets
6:16,Brandon Miller misses 12-foot step back jumpshot,48,56,Hornets
6:11,Ben Saraf defensive rebound,48,56,Nets
5:53,Tidjane Salaun personal foul,48,56,Hornets
5:53,Cam Thomas makes free throw 1 of 2,49,56,Nets
5:53,Cam Thomas makes free throw 2 of 2,50,56,Nets
5:37,LaMelo Ball misses 28-foot three point jumper,50,56,Hornets
5:34,Cam Thomas defensive rebound,50,56,Nets
5:19,Day'Ron Sharpe makes 4-foot hook shot (Cam Thomas assists),52,56,Nets
5:14,Tidjane Salaun misses two point shot,52,56,Hornets
5:14,Hornets offensive team rebound,52,56,Hornets
5:14,Miles Bridges enters the game for Moussa Diabate,52,56,Hornets
5:14,Ryan Kalkbrenner enters the game for Tidjane Salaun,52,56,Hornets
5:14,Ziaire Williams enters the game for Tyrese Martin,52,56,Nets
5:14,Terance Mann loose ball foul,52,56,Nets
5:06,Terance Mann shooting foul,52,56,Nets
5:06,LaMelo Ball misses free throw 1 of 2,52,56,Hornets
5:06,Hornets offensive team rebound,52,56,Hornets
5:06,LaMelo Ball makes free throw 2 of 2,52,57,Hornets
4:54,Cam Thomas traveling,52,57,Nets
4:34,LaMelo Ball makes 23-foot three point jumper (Collin Sexton assists),52,60,Hornets
4:22,Day'Ron Sharpe misses 25-foot three point jumper,52,60,Nets
4:19,Miles Bridges defensive rebound,52,60,Hornets
4:09,Miles Bridges makes 2-foot dunk (LaMelo Ball assists),52,62,Hornets
3:55,Ben Saraf makes 11-foot two point shot,54,62,Nets
3:48,Day'Ron Sharpe shooting foul,54,62,Nets
3:48,Brandon Miller misses free throw 1 of 2,54,62,Hornets
3:48,Hornets offensive team rebound,54,62,Hornets
3:48,Nic Claxton enters the game for Day'Ron Sharpe,54,62,Nets
3:48,Brandon Miller makes free throw 2 of 2,54,63,Hornets
3:38,Ziaire Williams misses 26-foot three point jumper,54,63,Nets
3:35,Hornets defensive team rebound,54,63,Hornets
3:35,Terance Mann loose ball foul,54,63,Nets
3:35,Collin Sexton misses free throw 1 of 2,54,63,Hornets
3:35,Hornets offensive team rebound,54,63,Hornets
3:35,Sion James enters the game for Brandon Miller,54,63,Hornets
3:35,Michael Porter Jr. enters the game for Terance Mann,54,63,Nets
3:35,Collin Sexton makes free throw 2 of 2,54,64,Hornets
3:28,Collin Sexton personal foul,54,64,Hornets
3:28,Cam Thomas makes free throw 1 of 2,55,64,Nets
3:28,Hornets Full timeout,55,64,Hornets
3:28,Brandon Miller enters the game for Collin Sexton,55,64,Hornets
3:28,Kon Knueppel enters the game for Sion James,55,64,Hornets
3:28,Cam Thomas misses free throw 2 of 2,55,64,Nets
3:28,Hornets delay of game violation,55,64,Hornets
3:28,Nets delay of game violation,55,64,Nets
3:25,Miles Bridges defensive rebound,55,64,Hornets
3:14,Brandon Miller makes 2-foot alley oop dunk shot (LaMelo Ball assists),55,66,Hornets
3:04,LaMelo Ball personal foul,55,66,Hornets
3:04,Ben Saraf makes free throw 1 of 2,56,66,Nets
3:04,Ben Saraf misses free throw 2 of 2,56,66,Nets
2:51,Miles Bridges defensive rebound,56,66,Hornets
2:30,LaMelo Ball misses driving floating jump shot,56,66,Hornets
2:28,Michael Porter Jr. defensive rebound,56,66,Nets
2:19,Ryan Kalkbrenner blocks Ben Saraf 's 2-foot layup,56,66,Nets
2:16,Ryan Kalkbrenner defensive rebound,56,66,Hornets
2:13,Miles Bridges makes 1-foot dunk (LaMelo Ball assists),56,68,Hornets
2:02,Kon Knueppel personal foul,56,68,Hornets
2:02,Cam Thomas makes free throw 1 of 2,57,68,Nets
2:02,Tre Mann enters the game for Kon Knueppel,57,68,Hornets
2:02,Cam Thomas makes free throw 2 of 2,58,68,Nets
1:58,Ziaire Williams personal foul,58,68,Nets
1:58,LaMelo Ball misses free throw 1 of 2,58,68,Hornets
1:58,Hornets offensive team rebound,58,68,Hornets
1:58,LaMelo Ball makes free throw 2 of 2,58,69,Hornets
1:47,Cam Thomas bad pass (LaMelo Ball steals),58,69,Nets
1:43,Brandon Miller makes 2-foot dunk (LaMelo Ball assists),58,71,Hornets
1:30,Cam Thomas misses 25-foot three point jumper,58,71,Nets
1:27,Tre Mann defensive rebound,58,71,Hornets
1:21,Miles Bridges makes 8-foot two point shot (Tre Mann assists),58,73,Hornets
1:04,Moussa Diabate enters the game for Ryan Kalkbrenner,58,73,Hornets
57.9,Michael Porter Jr. misses 25-foot three point step back jumpshot,58,73,Nets
55.6,Ben Saraf offensive rebound,58,73,Nets
50.2,Nic Claxton makes alley oop layup (Michael Porter Jr. assists),60,73,Nets
34.1,Ben Saraf shooting foul,60,73,Nets
34.1,Brandon Miller makes free throw 1 of 2,60,74,Hornets
34.1,Brandon Miller makes free throw 2 of 2,60,75,Hornets
15.8,Moussa Diabate blocks Ben Saraf 's 2-foot layup,60,75,Nets
11.9,Moussa Diabate defensive rebound,60,75,Hornets
11.9,Moussa Diabate makes 2-foot dunk,60,77,Hornets
0.0,Cam Thomas misses driving layup,60,77,Nets
0.0,Miles Bridges defensive rebound,60,77,Hornets
0.0,End of the 2nd Quarter,60,77,Unknown
,[ QUARTER 2 ENDED ],,,
12:00,Ryan Kalkbrenner enters the game for Tre Mann,60,77,Hornets
12:00,Kon Knueppel enters the game for Moussa Diabate,60,77,Hornets
12:00,Terance Mann enters the game for Ziaire Williams,60,77,Nets
11:43,Ryan Kalkbrenner makes layup (Miles Bridges assists),60,79,Hornets
11:21,Ben Saraf misses 23-foot three point jumper,60,79,Nets
11:18,Ryan Kalkbrenner defensive rebound,60,79,Hornets
11:10,Brandon Miller misses 25-foot three point jumper,60,79,Hornets
11:08,Ben Saraf defensive rebound,60,79,Nets
11:04,Terance Mann makes driving layup,62,79,Nets
11:04,Brandon Miller shooting foul,62,79,Hornets
11:04,Terance Mann makes free throw 1 of 1,63,79,Nets
10:46,Brandon Miller makes driving layup,63,81,Hornets
10:33,Michael Porter Jr. misses driving floating jump shot,63,81,Nets
10:29,LaMelo Ball defensive rebound,63,81,Hornets
10:22,Brandon Miller misses 23-foot three point jumper,63,81,Hornets
10:19,Michael Porter Jr. defensive rebound,63,81,Nets
10:08,Michael Porter Jr. makes layup (Nic Claxton assists),65,81,Nets
9:55,Miles Bridges makes 22-foot three point jumper (Brandon Miller assists),65,84,Hornets
9:41,Terance Mann misses driving layup,65,84,Nets
9:39,Kon Knueppel defensive rebound,65,84,Hornets
9:34,Kon Knueppel makes 25-foot three point shot (LaMelo Ball assists),65,87,Hornets
9:34,Nets Full timeout,65,87,Nets
9:34,(09:34) [Nets] COACH'S CHALLENGE (CALL REPLAYCENTER),65,87,Unknown
9:34,Jalen Wilson enters the game for Michael Porter Jr.,65,87,Nets
9:34,Tyrese Martin enters the game for Cam Thomas,65,87,Nets
9:14,Tyrese Martin makes 31-foot three point jumper (Terance Mann assists),68,87,Nets
8:59,LaMelo Ball misses 28-foot three point jumper,68,87,Hornets
8:58,Ryan Kalkbrenner offensive rebound,68,87,Hornets
8:56,Kon Knueppel makes 26-foot three point jumper (Brandon Miller assists),68,90,Hornets
8:35,Ben Saraf misses 23-foot three point jumper,68,90,Nets
8:33,Tyrese Martin offensive rebound,68,90,Nets
8:29,Terance Mann makes 26-foot three point jumper (Tyrese Martin assists),71,90,Nets
8:13,Kon Knueppel misses 25-foot three point jumper,71,90,Hornets
8:09,Ben Saraf defensive rebound,71,90,Nets
8:02,Ben Saraf misses 26-foot three point jumper,71,90,Nets
7:56,Nic Claxton offensive rebound,71,90,Nets
7:56,Nic Claxton makes tip shot,73,90,Nets
7:48,Ryan Kalkbrenner bad pass (Tyrese Martin steals),73,90,Hornets
7:43,Jalen Wilson makes 25-foot three point shot (Ben Saraf assists),76,90,Nets
7:43,Hornets Full timeout,76,90,Hornets
7:31,Ryan Kalkbrenner offensive foul,76,90,Hornets
7:31,Ryan Kalkbrenner turnover,76,90,Hornets
7:31,Moussa Diabate enters the game for Ryan Kalkbrenner,76,90,Hornets
7:18,Tyrese Martin out of bounds lost ball turnover,76,90,Nets
7:07,Brandon Miller makes 3-foot driving floating jump shot,76,92,Hornets
7:07,Tyrese Martin shooting foul,76,92,Nets
7:07,Brandon Miller makes free throw 1 of 1,76,93,Hornets
6:46,Nic Claxton makes 9-foot hook shot,78,93,Nets
6:37,Moussa Diabate makes 8-foot two point shot (Brandon Miller assists),78,95,Hornets
6:27,Brandon Miller shooting foul,78,95,Hornets
6:27,Ben Saraf makes free throw 1 of 2,79,95,Nets
6:27,Collin Sexton enters the game for Brandon Miller,79,95,Hornets
6:27,Ziaire Williams enters the game for Terance Mann,79,95,Nets
6:27,Ben Saraf makes free throw 2 of 2,80,95,Nets
6:21,Jalen Wilson personal foul,80,95,Nets
6:21,Egor Demin enters the game for Nic Claxton,80,95,Nets
6:21,Day'Ron Sharpe enters the game for Ben Saraf,80,95,Nets
6:11,LaMelo Ball makes 27-foot three point step back jumpshot,80,98,Hornets
5:57,Day'Ron Sharpe offensive foul,80,98,Nets
5:57,Day'Ron Sharpe turnover,80,98,Nets
5:44,Collin Sexton bad pass (Day'Ron Sharpe steals),80,98,Hornets
5:44,Day'Ron Sharpe out of bounds bad pass turnover,80,98,Nets
5:40,Kon Knueppel bad pass (Egor Demin steals),80,98,Hornets
5:38,LaMelo Ball personal foul,80,98,Hornets
5:29,Tyrese Martin misses driving layup,80,98,Nets
5:24,Day'Ron Sharpe offensive rebound,80,98,Nets
5:24,Day'Ron Sharpe makes two point shot,82,98,Nets
5:08,Collin Sexton misses 24-foot three point pullup jump shot,82,98,Hornets
5:04,Ziaire Williams defensive rebound,82,98,Nets
4:59,Day'Ron Sharpe out of bounds lost ball turnover,82,98,Nets
4:41,Collin Sexton misses two point shot,82,98,Hornets
4:39,Day'Ron Sharpe defensive rebound,82,98,Nets
4:31,Jalen Wilson misses 25-foot three point jumper,82,98,Nets
4:28,Miles Bridges defensive rebound,82,98,Hornets
4:28,Miles Bridges out of bounds bad pass turnover,82,98,Hornets
4:28,Tre Mann enters the game for Miles Bridges,82,98,Hornets
4:28,Tidjane Salaun enters the game for LaMelo Ball,82,98,Hornets
4:28,Noah Clowney enters the game for Day'Ron Sharpe,82,98,Nets
4:28,Sion James enters the game for Kon Knueppel,82,98,Hornets
4:13,Jalen Wilson makes two point shot (Noah Clowney assists),84,98,Nets
4:01,Tre Mann lost ball turnover (Ziaire Williams steals),84,98,Hornets
3:56,Ziaire Williams misses two point shot,84,98,Nets
3:52,Tyrese Martin offensive rebound,84,98,Nets
3:52,Tyrese Martin misses tip shot,84,98,Nets
3:51,Sion James defensive rebound,84,98,Hornets
3:51,Egor Demin personal foul,84,98,Nets
3:38,Tidjane Salaun makes 1-foot alley oop dunk shot (Collin Sexton assists),84,100,Hornets
3:29,Tyrese Martin misses 27-foot three point jumper,84,100,Nets
3:26,Ziaire Williams offensive rebound,84,100,Nets
3:21,Tre Mann personal foul,84,100,Hornets
3:10,Tyrese Martin makes 7-foot two point shot,86,100,Nets
2:58,Collin Sexton makes driving layup,86,102,Hornets
2:44,Egor Demin makes 26-foot three point jumper (Noah Clowney assists),89,102,Nets
2:33,Tre Mann makes 28-foot three point jumper (Sion James assists),89,105,Hornets
2:08,Moussa Diabate personal foul,89,105,Hornets
2:08,Noah Clowney makes free throw 1 of 2,90,105,Nets
2:08,Drake Powell enters the game for Ziaire Williams,90,105,Nets
2:08,Noah Clowney makes free throw 2 of 2,91,105,Nets
1:59,Drake Powell personal foul,91,105,Nets
1:48,Collin Sexton misses two point shot,91,105,Hornets
1:45,Noah Clowney defensive rebound,91,105,Nets
1:40,Noah Clowney traveling,91,105,Nets
1:23,Tre Mann misses 26-foot three point pullup jump shot,91,105,Hornets
1:21,Moussa Diabate offensive rebound,91,105,Hornets
1:21,Egor Demin shooting foul,91,105,Nets
1:21,Moussa Diabate misses free throw 1 of 2,91,105,Hornets
1:21,Hornets offensive team rebound,91,105,Hornets
1:21,Michael Porter Jr. enters the game for Jalen Wilson,91,105,Nets
1:21,Moussa Diabate makes free throw 2 of 2,91,106,Hornets
1:07,Egor Demin makes 26-foot three point jumper (Michael Porter Jr. assists),94,106,Nets
58.0,Collin Sexton makes 2-foot two point shot,94,108,Hornets
58.0,Drake Powell shooting foul,94,108,Nets
58.0,Collin Sexton makes free throw 1 of 1,94,109,Hornets
49.0,Egor Demin out of bounds bad pass turnover,94,109,Nets
31.0,Noah Clowney shooting foul,94,109,Nets
31.0,Moussa Diabate makes free throw 1 of 2,94,110,Hornets
31.0,Moussa Diabate makes free throw 2 of 2,94,111,Hornets
19.4,Noah Clowney makes 26-foot three point jumper (Egor Demin assists),97,111,Nets
3.3,Sion James misses 22-foot three point jumper,97,111,Hornets
0.3,Moussa Diabate offensive rebound,97,111,Hornets
0.0,Moussa Diabate misses tip shot,97,111,Hornets
0.0,Hornets offensive team rebound,97,111,Hornets
0.0,End of the 3rd Quarter,97,111,Unknown
,[ QUARTER 3 ENDED ],,,
12:00,Ryan Kalkbrenner enters the game for Collin Sexton,97,111,Hornets
12:00,Miles Bridges enters the game for Moussa Diabate,97,111,Hornets
12:00,Kon Knueppel enters the game for Tidjane Salaun,97,111,Hornets
12:00,Cam Thomas enters the game for Egor Demin,97,111,Nets
12:00,Nolan Traore enters the game for Tyrese Martin,97,111,Nets
12:00,Nic Claxton enters the game for Noah Clowney,97,111,Nets
11:39,Cam Thomas misses 9-foot pullup jump shot,97,111,Nets
11:37,Kon Knueppel defensive rebound,97,111,Hornets
11:31,Sion James misses driving dunk,97,111,Hornets
11:29,Drake Powell defensive rebound,97,111,Nets
11:26,Drake Powell makes two point shot,99,111,Nets
11:19,Drake Powell personal foul,99,111,Nets
11:09,Nolan Traore defensive 3-seconds (technical foul),99,111,Nets
11:09,Tre Mann misses technical free throw,99,111,Hornets
11:09,Hornets offensive team rebound,99,111,Hornets
10:55,Tre Mann misses two point shot,99,111,Hornets
10:53,Ryan Kalkbrenner offensive rebound,99,111,Hornets
10:51,Tre Mann makes 22-foot three point jumper (Miles Bridges assists),99,114,Hornets
10:33,Nic Claxton double dribble turnover,99,114,Nets
10:17,Tre Mann makes 2-foot two point shot,99,116,Hornets
10:03,Nolan Traore makes 26-foot three point jumper (Cam Thomas assists),102,116,Nets
9:50,Ryan Kalkbrenner makes dunk (Tre Mann assists),102,118,Hornets
9:40,Nic Claxton misses 26-foot three point jumper,102,118,Nets
9:33,Tre Mann defensive rebound,102,118,Hornets
