time,description,home_score,away_score,team
12:00,Ivica Zubac vs. Walker Kessler (Keyonte George gains possession),0,0,Jazz
11:40,Lauri Markkanen misses 26-foot three point jumper,0,0,Jazz
11:37,Kyle Filipowski offensive rebound,0,0,Jazz
11:33,Lauri Markkanen makes 25-foot three point step back jumpshot (Kyle Filipowski assists),0,3,Jazz
11:17,Keyonte George personal foul,0,3,Jazz
11:11,Bradley Beal misses 22-foot three point jumper,0,3,Clippers
11:08,Walker Kessler defensive rebound,0,3,Jazz
10:54,Kawhi Leonard blocks Lauri Markkanen 's 25-foot three point jumper,0,3,Jazz
10:50,Bradley Beal defensive rebound,0,3,Clippers
10:47,Kawhi Leonard misses 23-foot three point shot,0,3,Clippers
10:47,Keyonte George defensive rebound,0,3,Jazz
10:41,Lauri Markkanen makes 3-foot dunk (Keyonte George assists),0,5,Jazz
10:19,Ivica Zubac makes 3-foot two point shot,2,5,Clippers
10:05,Derrick Jones Jr. shooting foul,2,5,Clippers
10:05,Walker Kessler makes free throw 1 of 2,2,6,Jazz
10:05,Walker Kessler misses free throw 2 of 2,2,6,Jazz
10:03,Kawhi Leonard defensive rebound,2,6,Clippers
9:52,Bradley Beal makes 25-foot three point jumper (James Harden assists),5,6,Clippers
9:39,Lauri Markkanen makes alley oop layup (Keyonte George assists),5,8,Jazz
9:18,James Harden misses 25-foot three point step back jumpshot,5,8,Clippers
9:15,Kyle Filipowski defensive rebound,5,8,Jazz
8:58,Walker Kessler makes 25-foot three point jumper (Keyonte George assists),5,11,Jazz
8:37,James Harden makes 9-foot pullup jump shot,7,11,Clippers
8:24,Walker Kessler makes 5-foot alley oop dunk shot (Lauri Markkanen assists),7,13,Jazz
8:13,Kawhi Leonard out of bounds lost ball turnover,7,13,Clippers
8:02,Lauri Markkanen makes 6-foot layup (Kyle Filipowski assists),7,15,Jazz
8:01,Clippers Full timeout,7,15,Clippers
7:48,Kawhi Leonard makes 9-foot pullup jump shot (James Harden assists),9,15,Clippers
7:30,Walker Kessler makes 5-foot hook shot (Keyonte George assists),9,17,Jazz
7:09,Kyle Filipowski personal foul,9,17,Jazz
7:09,Bradley Beal bad pass (Keyonte George steals),9,17,Clippers
7:05,Keyonte George makes 3-foot dunk,9,19,Jazz
6:50,Svi Mykhailiuk kicked ball violation,9,19,Jazz
6:50,Brice Sensabaugh enters the game for Kyle Filipowski,9,19,Jazz
6:50,Ace Bailey enters the game for Svi Mykhailiuk,9,19,Jazz
6:39,James Harden makes 29-foot three pointer,12,19,Clippers
6:25,Kawhi Leonard personal foul,12,19,Clippers
6:24,Keyonte George out of bounds bad pass turnover,12,19,Jazz
6:19,Ivica Zubac makes 3-foot dunk (James Harden assists),14,19,Clippers
6:18,Jazz Full timeout,14,19,Jazz
6:09,Keyonte George makes driving layup (Walker Kessler assists),14,21,Jazz
5:53,Kawhi Leonard misses 10-foot pullup jump shot,14,21,Clippers
5:50,Ace Bailey defensive rebound,14,21,Jazz
5:40,Derrick Jones Jr. personal foul,14,21,Clippers
5:40,Taylor Hendricks enters the game for Lauri Markkanen,14,21,Jazz
5:40,John Collins enters the game for Bradley Beal,14,21,Clippers
5:40,Kris Dunn enters the game for Derrick Jones Jr.,14,21,Clippers
5:30,Walker Kessler makes 1-foot dunk (Ace Bailey assists),14,23,Jazz
5:18,Ivica Zubac misses 11-foot hook shot,14,23,Clippers
5:15,Walker Kessler defensive rebound,14,23,Jazz
5:08,Keyonte George misses 25-foot three point jumper,14,23,Jazz
5:06,Clippers defensive team rebound,14,23,Clippers
4:58,James Harden bad pass (Walker Kessler steals),14,23,Clippers
4:41,Walker Kessler makes 23-foot three point jumper (Keyonte George assists),14,26,Jazz
4:26,Jusuf Nurkic enters the game for Walker Kessler,14,26,Jazz
4:19,James Harden makes 10-foot step back jumpshot,16,26,Clippers
4:02,James Harden shooting foul,16,26,Clippers
4:02,Brice Sensabaugh makes free throw 1 of 2,16,27,Jazz
4:02,Walter Clayton Jr. enters the game for Keyonte George,16,27,Jazz
4:02,Brice Sensabaugh makes free throw 2 of 2,16,28,Jazz
3:48,Kawhi Leonard bad pass (Brice Sensabaugh steals),16,28,Clippers
3:48,Brice Sensabaugh steps out of bounds turnover,16,28,Jazz
3:48,Brook Lopez enters the game for Ivica Zubac,16,28,Clippers
3:48,Chris Paul enters the game for James Harden,16,28,Clippers
3:47,John Collins bad pass (Jusuf Nurkic steals),16,28,Clippers
3:44,Jusuf Nurkic makes 4-foot dunk,16,30,Jazz
3:26,Kris Dunn bad pass (Jusuf Nurkic steals),16,30,Clippers
3:15,Walter Clayton Jr. makes 10-foot two point shot,16,32,Jazz
3:15,Brook Lopez shooting foul,16,32,Clippers
3:15,Nicolas Batum enters the game for Kawhi Leonard,16,32,Clippers
3:15,Walter Clayton Jr. makes free throw 1 of 1,16,33,Jazz
3:09,Chris Paul bad pass (Walter Clayton Jr. steals),16,33,Clippers
3:06,Ace Bailey makes 8-foot dunk (Walter Clayton Jr. assists),16,35,Jazz
3:06,Clippers Full timeout,16,35,Clippers
2:46,Taylor Hendricks blocks John Collins 's 8-foot two point shot,16,35,Clippers
2:44,Brice Sensabaugh defensive rebound,16,35,Jazz
2:37,Nicolas Batum shooting foul,16,35,Clippers
2:37,Taylor Hendricks makes free throw 1 of 2,16,36,Jazz
2:37,Taylor Hendricks makes free throw 2 of 2,16,37,Jazz
2:24,Nicolas Batum misses 23-foot three point jumper,16,37,Clippers
2:20,John Collins offensive rebound,16,37,Clippers
2:19,John Collins traveling,16,37,Clippers
2:10,Jusuf Nurkic bad pass (Brook Lopez steals),16,37,Jazz
2:01,Brice Sensabaugh personal foul,16,37,Jazz
2:01,Lauri Markkanen enters the game for Ace Bailey,16,37,Jazz
1:52,Jusuf Nurkic personal foul,16,37,Jazz
1:46,Brook Lopez misses 31-foot three point jumper,16,37,Clippers
1:43,Taylor Hendricks defensive rebound,16,37,Jazz
1:43,John Collins personal foul,16,37,Clippers
1:43,Taylor Hendricks misses free throw 1 of 2,16,37,Jazz
1:43,Jazz offensive team rebound,16,37,Jazz
1:43,Taylor Hendricks makes free throw 2 of 2,16,38,Jazz
1:24,Nicolas Batum misses 23-foot three point jumper,16,38,Clippers
1:21,Brook Lopez offensive rebound,16,38,Clippers
1:18,Nicolas Batum makes 23-foot three point jumper (Kris Dunn assists),19,38,Clippers
1:06,Walter Clayton Jr. makes driving layup,19,40,Jazz
55.1,Brook Lopez misses 25-foot three point jumper,19,40,Clippers
52.3,Walter Clayton Jr. defensive rebound,19,40,Jazz
46.9,Walter Clayton Jr. makes 25-foot three point shot (Jusuf Nurkic assists),19,43,Jazz
33.8,Chris Paul misses 25-foot three point jumper,19,43,Clippers
30.9,Taylor Hendricks defensive rebound,19,43,Jazz
16.4,Walter Clayton Jr. misses 29-foot three point jumper,19,43,Jazz
12.4,Kris Dunn defensive rebound,19,43,Clippers
1.0,Brook Lopez bad pass (Walter Clayton Jr. steals),19,43,Clippers
0.0,End of the 1st Quarter,19,43,Unknown
,[ QUARTER 1 ENDED ],,,
12:00,Svi Mykhailiuk enters the game for Taylor Hendricks,19,43,Jazz
12:00,Kyle Filipowski enters the game for Brice Sensabaugh,19,43,Jazz
11:44,Walter Clayton Jr. personal foul,19,43,Jazz
11:37,Kyle Filipowski blocks Brook Lopez 's 5-foot layup,19,43,Clippers
11:37,Jazz defensive team rebound,19,43,Jazz
11:15,Svi Mykhailiuk makes 26-foot three point step back jumpshot,19,46,Jazz
10:57,Brook Lopez makes 26-foot three point jumper (Chris Paul assists),22,46,Clippers
10:40,Lauri Markkanen lost ball turnover (Nicolas Batum steals),22,46,Jazz
10:36,John Collins makes 3-foot dunk (Nicolas Batum assists),24,46,Clippers
10:24,Nicolas Batum personal foul,24,46,Clippers
10:24,Bradley Beal enters the game for Nicolas Batum,24,46,Clippers
10:16,Kyle Filipowski misses 22-foot three point jumper,24,46,Jazz
10:12,Walter Clayton Jr. offensive rebound,24,46,Jazz
10:10,Svi Mykhailiuk makes 25-foot three point jumper (Lauri Markkanen assists),24,49,Jazz
9:53,Brook Lopez makes 28-foot three point jumper (John Collins assists),27,49,Clippers
9:38,Walter Clayton Jr. misses 19-foot pullup jump shot,27,49,Jazz
9:35,Brook Lopez defensive rebound,27,49,Clippers
9:25,Brook Lopez makes 27-foot three point jumper (Chris Paul assists),30,49,Clippers
9:11,Jusuf Nurkic misses 26-foot three point jumper,30,49,Jazz
9:08,John Collins defensive rebound,30,49,Clippers
8:59,James Harden enters the game for Chris Paul,30,49,Clippers
8:51,Brook Lopez misses 29-foot three point jumper,30,49,Clippers
8:49,Lauri Markkanen defensive rebound,30,49,Jazz
8:41,Lauri Markkanen makes 25-foot three point jumper (Kyle Filipowski assists),30,52,Jazz
8:29,Lauri Markkanen kicked ball violation,30,52,Jazz
8:29,Ace Bailey enters the game for Lauri Markkanen,30,52,Jazz
8:24,Bradley Beal makes 14-foot pullup jump shot (James Harden assists),32,52,Clippers
8:21,Jazz Full timeout,32,52,Jazz
8:21,Keyonte George enters the game for Walter Clayton Jr.,32,52,Jazz
8:21,Walker Kessler enters the game for Jusuf Nurkic,32,52,Jazz
8:21,Kawhi Leonard enters the game for John Collins,32,52,Clippers
8:02,Ace Bailey bad pass (Bradley Beal steals),32,52,Jazz
7:54,Kyle Filipowski shooting foul,32,52,Jazz
7:54,James Harden misses free throw 1 of 2,32,52,Clippers
7:54,Clippers offensive team rebound,32,52,Clippers
7:54,James Harden makes free throw 2 of 2,33,52,Clippers
7:43,Ace Bailey misses 23-foot three point jumper,33,52,Jazz
7:40,Kris Dunn defensive rebound,33,52,Clippers
7:29,Brook Lopez misses 30-foot three point jumper,33,52,Clippers
7:26,Kris Dunn offensive rebound,33,52,Clippers
7:13,James Harden misses 26-foot three point jumper,33,52,Clippers
7:09,Walker Kessler defensive rebound,33,52,Jazz
6:59,Bradley Beal personal foul,33,52,Clippers
6:59,Ivica Zubac enters the game for Kris Dunn,33,52,Clippers
6:59,Derrick Jones Jr. enters the game for Brook Lopez,33,52,Clippers
6:51,Kyle Filipowski makes 23-foot three point jumper (Svi Mykhailiuk assists),33,55,Jazz
6:34,Kyle Filipowski personal foul,33,55,Jazz
6:34,Taylor Hendricks enters the game for Svi Mykhailiuk,33,55,Jazz
6:34,Lauri Markkanen enters the game for Kyle Filipowski,33,55,Jazz
6:29,Derrick Jones Jr. bad pass (Taylor Hendricks steals),33,55,Clippers
6:25,Taylor Hendricks lost ball turnover (Kawhi Leonard steals),33,55,Jazz
6:20,James Harden makes two point shot (Kawhi Leonard assists),35,55,Clippers
6:09,Bradley Beal personal foul,35,55,Clippers
5:57,Lauri Markkanen makes 29-foot three point jumper (Walker Kessler assists),35,58,Jazz
5:40,Ivica Zubac makes 3-foot dunk (James Harden assists),37,58,Clippers
5:26,Taylor Hendricks makes 23-foot three point jumper (Keyonte George assists),37,61,Jazz
5:03,James Harden misses 25-foot three point jumper,37,61,Clippers
5:01,Lauri Markkanen defensive rebound,37,61,Jazz
4:53,Keyonte George misses 25-foot three point jumper,37,61,Jazz
4:50,Ace Bailey offensive rebound,37,61,Jazz
4:48,Ace Bailey misses 17-foot pullup jump shot,37,61,Jazz
4:46,James Harden defensive rebound,37,61,Clippers
4:36,Ivica Zubac makes 5-foot hook shot,39,61,Clippers
4:20,Derrick Jones Jr. shooting foul,39,61,Clippers
4:20,Keyonte George makes free throw 1 of 2,39,62,Jazz
4:20,Brice Sensabaugh enters the game for Ace Bailey,39,62,Jazz
4:20,Kris Dunn enters the game for Derrick Jones Jr.,39,62,Clippers
4:20,Keyonte George makes free throw 2 of 2,39,63,Jazz
3:59,Kawhi Leonard misses 25-foot three point jumper,39,63,Clippers
3:56,Taylor Hendricks defensive rebound,39,63,Jazz
3:41,Keyonte George makes driving layup (Brice Sensabaugh assists),39,65,Jazz
3:28,James Harden makes 25-foot three point jumper (Kawhi Leonard assists),42,65,Clippers
2:59,Taylor Hendricks bad pass (Kris Dunn steals),42,65,Jazz
2:53,Bradley Beal misses 25-foot three point shot,42,65,Clippers
2:51,Ivica Zubac offensive rebound,42,65,Clippers
2:51,Ivica Zubac makes two point shot,44,65,Clippers
2:51,Brice Sensabaugh shooting foul,44,65,Jazz
2:51,Clippers Full timeout,44,65,Clippers
2:51,Svi Mykhailiuk enters the game for Taylor Hendricks,44,65,Jazz
2:51,Ivica Zubac makes free throw 1 of 1,45,65,Clippers
2:32,Brice Sensabaugh makes 10-foot two point shot (Svi Mykhailiuk assists),45,67,Jazz
2:13,Ivica Zubac makes 8-foot two point shot (James Harden assists),47,67,Clippers
1:59,Bradley Beal shooting foul,47,67,Clippers
1:59,Keyonte George misses free throw 1 of 2,47,67,Jazz
1:59,Jazz offensive team rebound,47,67,Jazz
1:59,Nicolas Batum enters the game for Bradley Beal,47,67,Clippers
1:59,Keyonte George makes free throw 2 of 2,47,68,Jazz
1:44,Kris Dunn misses two point shot,47,68,Clippers
1:40,Walker Kessler defensive rebound,47,68,Jazz
1:29,Brice Sensabaugh makes 28-foot three point jumper (Walker Kessler assists),47,71,Jazz
1:11,Walker Kessler blocks Ivica Zubac 's 6-foot two point shot,47,71,Clippers
1:08,Svi Mykhailiuk defensive rebound,47,71,Jazz
1:02,Svi Mykhailiuk misses 28-foot three point jumper,47,71,Jazz
1:00,Kris Dunn defensive rebound,47,71,Clippers
50.6,Walker Kessler blocks Ivica Zubac 's 4-foot two point shot,47,71,Clippers
47.6,Walker Kessler defensive rebound,47,71,Jazz
41.2,Brice Sensabaugh makes 26-foot three point jumper (Svi Mykhailiuk assists),47,74,Jazz
29.8,James Harden misses 26-foot three point jumper,47,74,Clippers
27.3,Walker Kessler defensive rebound,47,74,Jazz
9.3,Walker Kessler makes 4-foot hook shot (Keyonte George assists),47,76,Jazz
4.4,Kris Dunn out of bounds bad pass turnover,47,76,Clippers
1.0,Keyonte George makes 11-foot driving floating jump shot,47,78,Jazz
0.0,(00:00) [Clippers] REF-INITIATED REVIEW (REPLAY SUPPORTS CALL),47,78,Unknown
0.0,End of the 2nd Quarter,47,78,Unknown
,[ QUARTER 2 ENDED ],,,
12:00,Kyle Filipowski enters the game for Brice Sensabaugh,47,78,Jazz
12:00,Bradley Beal enters the game for Kris Dunn,47,78,Clippers
12:00,Derrick Jones Jr. enters the game for Nicolas Batum,47,78,Clippers
11:44,Ivica Zubac lost ball turnover (Walker Kessler steals),47,78,Clippers
11:33,Kyle Filipowski misses 25-foot three point jumper,47,78,Jazz
11:30,Walker Kessler offensive rebound,47,78,Jazz
11:29,Walker Kessler makes two point shot,47,80,Jazz
11:22,Kawhi Leonard misses 24-foot three point jumper,47,80,Clippers
11:20,Kawhi Leonard offensive rebound,47,80,Clippers
11:18,Kawhi Leonard makes 8-foot pullup jump shot,49,80,Clippers
10:50,Keyonte George misses 24-foot three point pullup jump shot,49,80,Jazz
10:50,Jazz offensive team rebound,49,80,Jazz
10:50,shot clock turnover,49,80,Jazz
10:32,Derrick Jones Jr. makes 25-foot three point jumper (Ivica Zubac assists),52,80,Clippers
10:20,Kyle Filipowski misses 25-foot three point jumper,52,80,Jazz
10:15,Kawhi Leonard defensive rebound,52,80,Clippers
10:00,Kawhi Leonard misses 21-foot jumper,52,80,Clippers
9:57,Keyonte George defensive rebound,52,80,Jazz
9:52,Kawhi Leonard shooting foul,52,80,Clippers
9:52,Walker Kessler makes free throw 1 of 2,52,81,Jazz
9:52,Walker Kessler makes free throw 2 of 2,52,82,Jazz
9:37,Bradley Beal misses 27-foot three point jumper,52,82,Clippers
9:33,Kyle Filipowski defensive rebound,52,82,Jazz
9:21,Kyle Filipowski makes 3-foot dunk (Lauri Markkanen assists),52,84,Jazz
9:06,Derrick Jones Jr. makes 2-foot dunk (Ivica Zubac assists),54,84,Clippers
8:43,Lauri Markkanen misses 25-foot three point jumper,54,84,Jazz
8:39,Kyle Filipowski offensive rebound,54,84,Jazz
8:36,Lauri Markkanen makes alley oop layup (Walker Kessler assists),54,86,Jazz
8:23,James Harden misses 25-foot three point step back jumpshot,54,86,Clippers
8:21,Walker Kessler defensive rebound,54,86,Jazz
8:14,Keyonte George misses 25-foot three point pullup jump shot,54,86,Jazz
8:12,Lauri Markkanen offensive rebound,54,86,Jazz
8:10,Ivica Zubac blocks Lauri Markkanen 's 5-foot two point shot,54,86,Jazz
8:08,Jazz offensive team rebound,54,86,Jazz
8:08,Derrick Jones Jr. kicked ball violation,54,86,Clippers
8:01,Svi Mykhailiuk makes 25-foot three point jumper (Kyle Filipowski assists),54,89,Jazz
7:51,James Harden bad pass (Svi Mykhailiuk steals),54,89,Clippers
7:45,Kyle Filipowski makes 3-foot dunk (Keyonte George assists),54,91,Jazz
7:44,Clippers Full timeout,54,91,Clippers
7:30,Ivica Zubac misses 7-foot hook shot,54,91,Clippers
7:28,Derrick Jones Jr. offensive rebound,54,91,Clippers
7:28,Derrick Jones Jr. makes dunk,56,91,Clippers
7:19,Kyle Filipowski misses 25-foot three point jumper,56,91,Jazz
7:12,Kawhi Leonard defensive rebound,56,91,Clippers
7:12,Walker Kessler personal foul,56,91,Jazz
6:53,Ivica Zubac makes 1-foot two point shot (James Harden assists),58,91,Clippers
6:32,Bradley Beal shooting foul,58,91,Clippers
6:32,Walker Kessler makes free throw 1 of 2,58,92,Jazz
6:32,Ace Bailey enters the game for Svi Mykhailiuk,58,92,Jazz
6:32,Brice Sensabaugh enters the game for Kyle Filipowski,58,92,Jazz
6:32,John Collins enters the game for Bradley Beal,58,92,Clippers
6:32,Walker Kessler misses free throw 2 of 2,58,92,Jazz
6:30,James Harden defensive rebound,58,92,Clippers
6:07,Ivica Zubac lost ball turnover (Keyonte George steals),58,92,Clippers
6:04,Keyonte George makes two point shot (Lauri Markkanen assists),58,94,Jazz
5:44,James Harden misses 25-foot three point jumper,58,94,Clippers
5:41,Clippers offensive team rebound,58,94,Clippers
5:41,Walker Kessler loose ball foul,58,94,Jazz
5:38,Derrick Jones Jr. misses 24-foot three point jumper,58,94,Clippers
5:36,Ivica Zubac offensive rebound,58,94,Clippers
5:34,Derrick Jones Jr. makes 5-foot dunk (Ivica Zubac assists),60,94,Clippers
5:34,Walker Kessler shooting foul,60,94,Jazz
5:34,Derrick Jones Jr. makes free throw 1 of 1,61,94,Clippers
5:28,Derrick Jones Jr. personal foul,61,94,Clippers
5:28,Taylor Hendricks enters the game for Lauri Markkanen,61,94,Jazz
5:17,Derrick Jones Jr. blocks Brice Sensabaugh 's 14-foot pullup jump shot,61,94,Jazz
5:14,Ivica Zubac defensive rebound,61,94,Clippers
5:12,Derrick Jones Jr. makes layup (James Harden assists),63,94,Clippers
5:12,Brice Sensabaugh shooting foul,63,94,Jazz
5:12,Jazz Full timeout,63,94,Jazz
5:12,Jusuf Nurkic enters the game for Walker Kessler,63,94,Jazz
5:12,Derrick Jones Jr. misses free throw 1 of 1,63,94,Clippers
5:11,Brice Sensabaugh defensive rebound,63,94,Jazz
4:57,Brice Sensabaugh makes 17-foot pullup jump shot (Jusuf Nurkic assists),63,96,Jazz
4:37,Derrick Jones Jr. misses 23-foot three point jumper,63,96,Clippers
4:33,Taylor Hendricks defensive rebound,63,96,Jazz
4:21,Jusuf Nurkic misses 11-foot jump bank shot,63,96,Jazz
4:17,Ivica Zubac defensive rebound,63,96,Clippers
4:14,Kawhi Leonard misses 23-foot three point jumper,63,96,Clippers
4:09,Ace Bailey defensive rebound,63,96,Jazz
4:04,Keyonte George makes 24-foot three point jumper (Ace Bailey assists),63,99,Jazz
3:48,John Collins makes 23-foot three point jumper (James Harden assists),66,99,Clippers
3:35,Keyonte George bad pass (John Collins steals),66,99,Jazz
3:32,John Collins makes 5-foot dunk (Derrick Jones Jr. assists),68,99,Clippers
3:22,Brice Sensabaugh misses 27-foot three point jumper,68,99,Jazz
3:19,Jazz offensive team rebound,68,99,Jazz
3:19,Walter Clayton Jr. enters the game for Keyonte George,68,99,Jazz
3:19,Kris Dunn enters the game for Derrick Jones Jr.,68,99,Clippers
3:13,Jusuf Nurkic makes layup (Brice Sensabaugh assists),68,101,Jazz
2:52,John Collins misses 26-foot three point jumper,68,101,Clippers
2:48,Walter Clayton Jr. defensive rebound,68,101,Jazz
2:37,Taylor Hendricks makes 14-foot two point shot (Jusuf Nurkic assists),68,103,Jazz
2:16,Ivica Zubac makes 5-foot two point shot (James Harden assists),70,103,Clippers
2:02,Walter Clayton Jr. out of bounds bad pass turnover,70,103,Jazz
2:02,Lauri Markkanen enters the game for Ace Bailey,70,103,Jazz
1:50,Walter Clayton Jr. shooting foul,70,103,Jazz
1:50,James Harden makes free throw 1 of 2,71,103,Clippers
1:50,James Harden makes free throw 2 of 2,72,103,Clippers
1:36,Jusuf Nurkic misses 2-foot two point shot,72,103,Jazz
1:33,Ivica Zubac defensive rebound,72,103,Clippers
1:25,Kawhi Leonard makes 25-foot three point jumper (James Harden assists),75,103,Clippers
1:13,Brice Sensabaugh misses 27-foot three point jumper,75,103,Jazz
1:07,Jusuf Nurkic offensive rebound,75,103,Jazz
1:06,Brice Sensabaugh makes 25-foot three point jumper (Walter Clayton Jr. assists),75,106,Jazz
48.2,Brice Sensabaugh shooting foul,75,106,Jazz
48.2,Kawhi Leonard makes free throw 1 of 2,76,106,Clippers
48.2,Kawhi Leonard makes free throw 2 of 2,77,106,Clippers
38.7,Jusuf Nurkic misses 25-foot three point jumper,77,106,Jazz
36.8,Ivica Zubac defensive rebound,77,106,Clippers
31.9,John Collins misses 8-foot two point shot,77,106,Clippers
29.8,Jusuf Nurkic defensive rebound,77,106,Jazz
12.6,Jusuf Nurkic makes 5-foot dunk (Walter Clayton Jr. assists),77,108,Jazz
12.6,Jusuf Nurkic hanging techfoul,77,108,Jazz
12.6,Kawhi Leonard makes technical free throw,78,108,Clippers
12.6,Svi Mykhailiuk enters the game for Brice Sensabaugh,78,108,Jazz
0.5,James Harden misses 25-foot three point jumper,78,108,Clippers
0.5,Ivica Zubac offensive rebound,78,108,Clippers
0.0,Ivica Zubac makes tip shot,80,108,Clippers
0.0,(00:00) [Clippers] REF-INITIATED REVIEW (REPLAY SUPPORTS CALL),80,108,Unknown
0.0,End of the 3rd Quarter,80,108,Unknown
,[ QUARTER 3 ENDED ],,,
12:00,Brook Lopez enters the game for James Harden,80,108,Clippers
12:00,Nicolas Batum enters the game for Kawhi Leonard,80,108,Clippers
12:00,Chris Paul enters the game for Ivica Zubac,80,108,Clippers
12:00,Kyle Filipowski enters the game for Taylor Hendricks,80,108,Jazz
11:38,Kyle Filipowski misses 24-foot three point jumper,80,108,Jazz
11:34,Jusuf Nurkic offensive rebound,80,108,Jazz
11:34,Jusuf Nurkic makes two point shot,80,110,Jazz
11:11,John Collins makes 9-foot two point shot (Chris Paul assists),82,110,Clippers
10:56,Lauri Markkanen makes 25-foot three point jumper (Walter Clayton Jr. assists),82,113,Jazz
10:41,Kyle Filipowski shooting foul,82,113,Jazz
10:41,John Collins misses free throw 1 of 2,82,113,Clippers
10:41,Clippers offensive team rebound,82,113,Clippers
10:41,John Collins makes free throw 2 of 2,83,113,Clippers
10:29,Walter Clayton Jr. misses 26-foot three point jumper,83,113,Jazz
10:26,Walter Clayton Jr. offensive rebound,83,113,Jazz
10:23,Walter Clayton Jr. makes two point shot,83,115,Jazz
10:09,Kris Dunn misses 11-foot two point shot,83,115,Clippers
10:06,Jusuf Nurkic defensive rebound,83,115,Jazz
9:51,Jusuf Nurkic misses 25-foot three point jumper,83,115,Jazz
9:48,John Collins defensive rebound,83,115,Clippers
9:41,Kris Dunn misses 23-foot three point jumper,83,115,Clippers
9:39,Kris Dunn offensive rebound,83,115,Clippers
9:34,Brook Lopez misses 26-foot three point jumper,83,115,Clippers
9:32,Walter Clayton Jr. defensive rebound,83,115,Jazz
9:21,Lauri Markkanen misses 15-foot pullup jump shot,83,115,Jazz
9:18,Clippers defensive team rebound,83,115,Clippers
9:10,John Collins misses 15-foot pullup jump shot,83,115,Clippers
9:07,Lauri Markkanen defensive rebound,83,115,Jazz
9:01,Nicolas Batum blocks Walter Clayton Jr. 's 5-foot driving layup,83,115,Jazz
8:58,Nicolas Batum defensive rebound,83,115,Clippers
8:50,Chris Paul misses 24-foot three point jumper,83,115,Clippers
8:48,Jusuf Nurkic defensive rebound,83,115,Jazz
8:36,Walter Clayton Jr. bad pass (Chris Paul steals),83,115,Jazz
8:21,Brook Lopez offensive foul,83,115,Clippers
8:21,Brook Lopez turnover,83,115,Clippers
8:21,Keyonte George enters the game for Walter Clayton Jr.,83,115,Jazz
8:21,Walker Kessler enters the game for Jusuf Nurkic,83,115,Jazz
8:11,Cam Christie enters the game for Kris Dunn,83,115,Clippers
8:06,Keyonte George misses 23-foot three point jumper,83,115,Jazz
8:04,Nicolas Batum defensive rebound,83,115,Clippers
8:00,Cam Christie misses 25-foot three point jumper,83,115,Clippers
7:58,John Collins offensive rebound,83,115,Clippers
7:56,John Collins makes two point shot,85,115,Clippers
7:55,Will Hardy technical foul,85,115,Jazz
7:55,Chris Paul makes technical free throw,86,115,Clippers
7:36,Brook Lopez shooting foul,86,115,Clippers
7:36,Walker Kessler makes free throw 1 of 2,86,116,Jazz
7:36,Brice Sensabaugh enters the game for Lauri Markkanen,86,116,Jazz
7:36,Walker Kessler makes free throw 2 of 2,86,117,Jazz
7:21,Chris Paul misses 24-foot three point jumper,86,117,Clippers
7:19,Brice Sensabaugh defensive rebound,86,117,Jazz
7:05,Keyonte George bad pass,86,117,Jazz
7:05,Walker Kessler loose ball foul,86,117,Jazz
7:00,Brook Lopez makes 25-foot three point jumper (Chris Paul assists),89,117,Clippers
6:42,Jazz Full timeout,89,117,Jazz
6:42,Ace Bailey enters the game for Svi Mykhailiuk,89,117,Jazz
6:31,Kyle Filipowski misses 12-foot two point shot,89,117,Jazz
6:29,John Collins defensive rebound,89,117,Clippers
6:17,Nicolas Batum misses 23-foot three point jumper,89,117,Clippers
6:14,Cam Christie offensive rebound,89,117,Clippers
6:12,Brook Lopez makes 25-foot three point jumper (Cam Christie assists),92,117,Clippers
5:56,Nicolas Batum personal foul,92,117,Clippers
5:56,Lauri Markkanen enters the game for Kyle Filipowski,92,117,Jazz
5:54,John Collins blocks Brice Sensabaugh 's 4-foot jumper,92,117,Jazz
5:52,John Collins defensive rebound,92,117,Clippers
5:46,Brook Lopez misses 28-foot three point jumper,92,117,Clippers
5:43,Chris Paul offensive rebound,92,117,Clippers
5:38,Chris Paul makes 23-foot three point jumper,95,117,Clippers
5:21,Brice Sensabaugh misses 25-foot three point jumper,95,117,Jazz
5:19,Lauri Markkanen offensive rebound,95,117,Jazz
5:19,Chris Paul personal foul,95,117,Clippers
5:06,Chris Paul personal foul,95,117,Clippers
5:00,Brice Sensabaugh makes 15-foot pullup jump shot (Keyonte George assists),95,119,Jazz
4:43,Brice Sensabaugh personal foul,95,119,Jazz
4:35,Walker Kessler blocks Cam Christie 's 6-foot driving layup,95,119,Clippers
4:35,Clippers offensive team rebound,95,119,Clippers
4:29,Chris Paul misses 15-foot pullup jump shot,95,119,Clippers
4:27,Brice Sensabaugh defensive rebound,95,119,Jazz
4:05,Keyonte George misses 27-foot three point pullup jump shot,95,119,Jazz
4:02,Brook Lopez defensive rebound,95,119,Clippers
3:57,John Collins misses dunk,95,119,Clippers
3:54,Lauri Markkanen defensive rebound,95,119,Jazz
