time,description,home_score,away_score,team
12:00,Chet Holmgren vs. Mouhamed Gueye (Dyson Daniels gains possession),0,0,Hawks
11:36,Nickeil Alexander-Walker misses driving floating jump shot,0,0,Hawks
11:34,Nickeil Alexander-Walker offensive rebound,0,0,Hawks
11:29,Onyeka Okongwu misses 22-foot three point jumper,0,0,Hawks
11:26,Chet Holmgren defensive rebound,0,0,Thunder
11:16,Chet Holmgren makes 25-foot three point jumper (Cason Wallace assists),3,0,Thunder
11:05,Onyeka Okongwu makes 1-foot driving dunk (Trae Young assists),3,2,Hawks
10:47,Mouhamed Gueye blocks Isaiah Hartenstein 's 2-foot driving layup,3,2,Thunder
10:44,Trae Young defensive rebound,3,2,Hawks
10:37,Dyson Daniels misses 6-foot two point shot,3,2,Hawks
10:33,Isaiah Hartenstein defensive rebound,3,2,Thunder
10:27,Shai Gilgeous-Alexander makes 11-foot step back jumpshot,5,2,Thunder
10:13,Nickeil Alexander-Walker makes 23-foot three point jumper (Trae Young assists),5,5,Hawks
9:56,Chet Holmgren makes 25-foot three point step back jumpshot,8,5,Thunder
9:40,Mouhamed Gueye makes 25-foot three point jumper (Onyeka Okongwu assists),8,8,Hawks
9:23,Shai Gilgeous-Alexander misses 25-foot three point jumper,8,8,Thunder
9:21,Nickeil Alexander-Walker defensive rebound,8,8,Hawks
8:59,Onyeka Okongwu misses 6-foot two point shot,8,8,Hawks
8:56,Shai Gilgeous-Alexander defensive rebound,8,8,Thunder
8:38,Isaiah Hartenstein makes alley oop dunk shot (Chet Holmgren assists),10,8,Thunder
8:26,Dyson Daniels lost ball turnover (Luguentz Dort steals),10,8,Hawks
8:19,Chet Holmgren lost ball turnover (Onyeka Okongwu steals),10,8,Thunder
8:08,Luguentz Dort personal foul,10,8,Thunder
8:00,Mouhamed Gueye misses 25-foot three point jumper,10,8,Hawks
7:56,Isaiah Hartenstein defensive rebound,10,8,Thunder
7:45,Shai Gilgeous-Alexander bad pass (Dyson Daniels steals),10,8,Thunder
7:40,Nickeil Alexander-Walker makes two point shot,10,10,Hawks
7:29,Luguentz Dort misses 25-foot three point jumper,10,10,Thunder
7:26,Dyson Daniels defensive rebound,10,10,Hawks
7:23,Trae Young misses two point shot,10,10,Hawks
7:22,Luguentz Dort defensive rebound,10,10,Thunder
7:22,Onyeka Okongwu personal foul,10,10,Hawks
7:08,Chet Holmgren misses driving floating jump shot,10,10,Thunder
7:08,Chet Holmgren offensive rebound,10,10,Thunder
7:08,Mouhamed Gueye shooting foul,10,10,Hawks
7:08,Chet Holmgren makes free throw 1 of 2,11,10,Thunder
7:08,Chet Holmgren makes free throw 2 of 2,12,10,Thunder
6:57,Onyeka Okongwu makes 2-foot layup (Trae Young assists),12,12,Hawks
6:43,Shai Gilgeous-Alexander makes 13-foot step back jumpshot,14,12,Thunder
6:32,Trae Young makes 5-foot driving floating jump shot,14,14,Hawks
6:31,Thunder Full timeout,14,14,Thunder
6:31,Luke Kennard enters the game for Dyson Daniels,14,14,Hawks
6:31,Vit Krejci enters the game for Trae Young,14,14,Hawks
6:31,Ajay Mitchell enters the game for Shai Gilgeous-Alexander,14,14,Thunder
6:13,Chet Holmgren makes 25-foot three point jumper (Ajay Mitchell assists),17,14,Thunder
5:43,Mouhamed Gueye misses driving floating jump shot,17,14,Hawks
5:39,Chet Holmgren defensive rebound,17,14,Thunder
5:32,Isaiah Hartenstein makes 1-foot alley oop dunk shot (Cason Wallace assists),19,14,Thunder
5:13,Vit Krejci makes 19-foot jumper (Onyeka Okongwu assists),19,16,Hawks
5:00,Chet Holmgren makes 26-foot three point jumper (Ajay Mitchell assists),22,16,Thunder
5:00,Hawks Full timeout,22,16,Hawks
5:00,Asa Newell enters the game for Mouhamed Gueye,22,16,Hawks
5:00,Jaylin Williams enters the game for Cason Wallace,22,16,Thunder
5:00,Aaron Wiggins enters the game for Isaiah Hartenstein,22,16,Thunder
4:45,Ajay Mitchell personal foul,22,16,Thunder
4:36,Onyeka Okongwu misses 25-foot three point jumper,22,16,Hawks
4:31,Asa Newell offensive rebound,22,16,Hawks
4:31,Chet Holmgren blocks Asa Newell's two point shot,22,16,Hawks
4:30,Asa Newell offensive rebound,22,16,Hawks
4:24,Nickeil Alexander-Walker makes driving layup,22,18,Hawks
4:09,Ajay Mitchell misses driving floating jump shot,22,18,Thunder
4:07,Onyeka Okongwu defensive rebound,22,18,Hawks
3:57,Onyeka Okongwu misses 9-foot two point shot,22,18,Hawks
3:53,Ajay Mitchell defensive rebound,22,18,Thunder
3:50,Luguentz Dort misses two point shot,22,18,Thunder
3:48,Onyeka Okongwu defensive rebound,22,18,Hawks
3:44,Nickeil Alexander-Walker misses 25-foot three point shot,22,18,Hawks
3:41,Chet Holmgren defensive rebound,22,18,Thunder
3:28,Jaylin Williams makes 1-foot layup (Ajay Mitchell assists),24,18,Thunder
3:19,Vit Krejci makes 26-foot three point jumper (Nickeil Alexander-Walker assists),24,21,Hawks
3:02,Jaylin Williams misses 25-foot three point jumper,24,21,Thunder
3:00,Onyeka Okongwu defensive rebound,24,21,Hawks
2:54,Vit Krejci offensive foul,24,21,Hawks
2:54,Vit Krejci turnover,24,21,Hawks
2:54,Dyson Daniels enters the game for Nickeil Alexander-Walker,24,21,Hawks
2:54,Trae Young enters the game for Onyeka Okongwu,24,21,Hawks
2:54,N'Faly Dante enters the game for Vit Krejci,24,21,Hawks
2:54,Brooks Barnhizer enters the game for Luguentz Dort,24,21,Thunder
2:54,Cason Wallace enters the game for Chet Holmgren,24,21,Thunder
2:40,Cason Wallace misses driving floating jump shot,24,21,Thunder
2:36,Cason Wallace offensive rebound,24,21,Thunder
2:31,Ajay Mitchell makes driving layup (Aaron Wiggins assists),26,21,Thunder
2:19,Trae Young misses driving floating jump shot,26,21,Hawks
2:15,N'Faly Dante offensive rebound,26,21,Hawks
2:15,N'Faly Dante misses tip shot,26,21,Hawks
2:14,N'Faly Dante offensive rebound,26,21,Hawks
2:12,N'Faly Dante misses two point shot,26,21,Hawks
2:10,Brooks Barnhizer defensive rebound,26,21,Thunder
2:07,Ajay Mitchell makes 23-foot three point shot (Cason Wallace assists),29,21,Thunder
1:56,Jaylin Williams personal foul,29,21,Thunder
1:49,Trae Young lost ball turnover (Cason Wallace steals),29,21,Hawks
1:44,Jaylin Williams makes two point shot (Ajay Mitchell assists),31,21,Thunder
1:25,Asa Newell makes 26-foot three point jumper (Luke Kennard assists),31,24,Hawks
1:09,Dyson Daniels blocks Brooks Barnhizer's layup,31,24,Thunder
1:06,Dyson Daniels defensive rebound,31,24,Hawks
1:01,Cason Wallace personal foul,31,24,Thunder
1:01,Trae Young makes free throw 1 of 2,31,25,Hawks
1:01,Shai Gilgeous-Alexander enters the game for Aaron Wiggins,31,25,Thunder
1:01,Trae Young makes free throw 2 of 2,31,26,Hawks
41.0,Shai Gilgeous-Alexander misses 23-foot three point step back jumpshot,31,26,Thunder
38.2,N'Faly Dante defensive rebound,31,26,Hawks
25.8,Dyson Daniels misses two point shot,31,26,Hawks
23.1,Shai Gilgeous-Alexander defensive rebound,31,26,Thunder
3.7,Cason Wallace misses 25-foot three point jumper,31,26,Thunder
0.1,Thunder offensive team rebound,31,26,Thunder
0.0,End of the 1st Quarter,31,26,Unknown
,[ QUARTER 1 ENDED ],,,
12:00,Vit Krejci enters the game for Trae Young,31,26,Hawks
12:00,Onyeka Okongwu enters the game for N'Faly Dante,31,26,Hawks
12:00,Keaton Wallace enters the game for Asa Newell,31,26,Hawks
12:00,Aaron Wiggins enters the game for Brooks Barnhizer,31,26,Thunder
12:00,Chris Youngblood enters the game for Ajay Mitchell,31,26,Thunder
11:47,Keaton Wallace personal foul,31,26,Hawks
11:41,Onyeka Okongwu blocks Cason Wallace 's 5-foot driving layup,31,26,Thunder
11:38,Onyeka Okongwu defensive rebound,31,26,Hawks
11:26,Onyeka Okongwu misses 9-foot two point shot,31,26,Hawks
11:23,Cason Wallace defensive rebound,31,26,Thunder
11:14,Chris Youngblood misses 25-foot three point jumper,31,26,Thunder
11:10,Vit Krejci defensive rebound,31,26,Hawks
11:01,Shai Gilgeous-Alexander blocks Vit Krejci 's 12-foot driving floating jump shot,31,26,Hawks
10:58,Dyson Daniels offensive rebound,31,26,Hawks
10:54,Keaton Wallace lost ball turnover (Cason Wallace steals),31,26,Hawks
10:50,Aaron Wiggins makes two point shot,33,26,Thunder
10:32,Cason Wallace shooting foul,33,26,Thunder
10:32,Vit Krejci makes free throw 1 of 3,33,27,Hawks
10:32,Vit Krejci makes free throw 2 of 3,33,28,Hawks
10:32,Vit Krejci misses free throw 3 of 3,33,28,Hawks
10:31,Jaylin Williams defensive rebound,33,28,Thunder
10:18,Shai Gilgeous-Alexander makes two point shot,35,28,Thunder
10:12,Aaron Wiggins shooting foul,35,28,Thunder
10:12,Dyson Daniels makes free throw 1 of 2,35,29,Hawks
10:12,Dyson Daniels misses free throw 2 of 2,35,29,Hawks
10:09,Cason Wallace defensive rebound,35,29,Thunder
9:47,Jaylin Williams misses 31-foot three point jumper,35,29,Thunder
9:42,Aaron Wiggins offensive rebound,35,29,Thunder
9:42,Aaron Wiggins makes two point shot,37,29,Thunder
9:30,Keaton Wallace misses 26-foot three point jumper,37,29,Hawks
9:26,Jaylin Williams defensive rebound,37,29,Thunder
9:19,Shai Gilgeous-Alexander misses 27-foot three point step back jumpshot,37,29,Thunder
9:15,Onyeka Okongwu defensive rebound,37,29,Hawks
9:01,Onyeka Okongwu misses 23-foot three point jumper,37,29,Hawks
8:58,Shai Gilgeous-Alexander defensive rebound,37,29,Thunder
8:46,Shai Gilgeous-Alexander makes 10-foot step back jumpshot,39,29,Thunder
8:46,Dyson Daniels shooting foul,39,29,Hawks
8:46,Isaiah Hartenstein enters the game for Jaylin Williams,39,29,Thunder
8:46,Ajay Mitchell enters the game for Cason Wallace,39,29,Thunder
8:46,Shai Gilgeous-Alexander makes free throw 1 of 1,40,29,Thunder
8:31,Dyson Daniels makes layup (Luke Kennard assists),40,31,Hawks
8:13,Chris Youngblood misses 26-foot three point jumper,40,31,Thunder
8:11,Onyeka Okongwu defensive rebound,40,31,Hawks
7:53,Onyeka Okongwu makes 22-foot three point jumper (Keaton Wallace assists),40,34,Hawks
7:39,Shai Gilgeous-Alexander misses 25-foot three point pullup jump shot,40,34,Thunder
7:36,Onyeka Okongwu defensive rebound,40,34,Hawks
7:32,Ajay Mitchell personal foul,40,34,Thunder
7:32,Nickeil Alexander-Walker enters the game for Dyson Daniels,40,34,Hawks
7:32,Asa Newell enters the game for Onyeka Okongwu,40,34,Hawks
7:32,Mouhamed Gueye enters the game for Vit Krejci,40,34,Hawks
7:14,Asa Newell misses 6-foot two point shot,40,34,Hawks
7:12,Shai Gilgeous-Alexander defensive rebound,40,34,Thunder
7:05,Aaron Wiggins makes 25-foot three point jumper (Shai Gilgeous-Alexander assists),43,34,Thunder
6:51,Keaton Wallace makes 17-foot pullup jump shot (Mouhamed Gueye assists),43,36,Hawks
6:38,Shai Gilgeous-Alexander makes 16-foot pullup jump shot,45,36,Thunder
6:37,Hawks Full timeout,45,36,Hawks
6:37,Vit Krejci enters the game for Keaton Wallace,45,36,Hawks
6:37,Trae Young enters the game for Luke Kennard,45,36,Hawks
6:37,Luguentz Dort enters the game for Shai Gilgeous-Alexander,45,36,Thunder
6:37,Chet Holmgren enters the game for Chris Youngblood,45,36,Thunder
6:22,Mouhamed Gueye misses 25-foot three point jumper,45,36,Hawks
6:19,Mouhamed Gueye offensive rebound,45,36,Hawks
6:17,Trae Young misses 23-foot three point jumper,45,36,Hawks
6:14,Ajay Mitchell defensive rebound,45,36,Thunder
6:02,Chet Holmgren offensive foul,45,36,Thunder
6:02,Chet Holmgren turnover,45,36,Thunder
5:50,Asa Newell offensive foul,45,36,Hawks
5:50,Asa Newell turnover,45,36,Hawks
5:33,Luguentz Dort misses 25-foot three point jumper,45,36,Thunder
5:30,Ajay Mitchell offensive rebound,45,36,Thunder
5:27,Vit Krejci personal foul,45,36,Hawks
5:20,Isaiah Hartenstein misses alley oop dunk shot,45,36,Thunder
5:18,Mouhamed Gueye defensive rebound,45,36,Hawks
5:14,Nickeil Alexander-Walker makes 25-foot three point shot (Trae Young assists),45,39,Hawks
5:02,Isaiah Hartenstein makes dunk (Ajay Mitchell assists),47,39,Thunder
4:51,Aaron Wiggins shooting foul,47,39,Thunder
4:51,Mouhamed Gueye misses free throw 1 of 2,47,39,Hawks
4:51,Hawks offensive team rebound,47,39,Hawks
4:51,Dyson Daniels enters the game for Asa Newell,47,39,Hawks
4:51,Onyeka Okongwu enters the game for Vit Krejci,47,39,Hawks
4:51,Shai Gilgeous-Alexander enters the game for Aaron Wiggins,47,39,Thunder
4:51,Cason Wallace enters the game for Isaiah Hartenstein,47,39,Thunder
4:51,Mouhamed Gueye makes free throw 2 of 2,47,40,Hawks
4:39,Chet Holmgren misses 25-foot three point jumper,47,40,Thunder
4:36,Mouhamed Gueye defensive rebound,47,40,Hawks
4:30,Onyeka Okongwu makes layup (Trae Young assists),47,42,Hawks
4:08,Cason Wallace misses driving layup,47,42,Thunder
4:04,Chet Holmgren offensive rebound,47,42,Thunder
4:04,Chet Holmgren makes tip shot,49,42,Thunder
4:01,Mouhamed Gueye makes 1-foot dunk (Trae Young assists),49,44,Hawks
4:01,Chet Holmgren shooting foul,49,44,Thunder
4:01,Thunder Full timeout,49,44,Thunder
4:01,Isaiah Hartenstein enters the game for Chet Holmgren,49,44,Thunder
4:01,Mouhamed Gueye misses free throw 1 of 1,49,44,Hawks
3:58,Isaiah Hartenstein defensive rebound,49,44,Thunder
3:42,Ajay Mitchell misses 11-foot pullup jump shot,49,44,Thunder
3:39,Mouhamed Gueye defensive rebound,49,44,Hawks
3:33,Nickeil Alexander-Walker makes two point shot (Trae Young assists),49,46,Hawks
3:23,Cason Wallace makes 25-foot three point jumper (Shai Gilgeous-Alexander assists),52,46,Thunder
3:12,Dyson Daniels makes 24-foot three point jumper (Trae Young assists),52,49,Hawks
2:56,Isaiah Hartenstein makes 11-foot two point shot,54,49,Thunder
2:39,Trae Young makes 22-foot three point jumper (Mouhamed Gueye assists),54,52,Hawks
2:39,Thunder Full timeout,54,52,Thunder
2:39,Aaron Wiggins enters the game for Ajay Mitchell,54,52,Thunder
2:15,Aaron Wiggins misses driving layup,54,52,Thunder
2:13,Isaiah Hartenstein offensive rebound,54,52,Thunder
2:11,Isaiah Hartenstein makes two point shot,56,52,Thunder
2:02,Shai Gilgeous-Alexander personal foul,56,52,Thunder
2:02,Trae Young makes free throw 1 of 2,56,53,Hawks
2:02,Trae Young misses free throw 2 of 2,56,53,Hawks
2:00,Isaiah Hartenstein defensive rebound,56,53,Thunder
1:43,Aaron Wiggins misses 23-foot three point jumper,56,53,Thunder
1:40,Onyeka Okongwu defensive rebound,56,53,Hawks
1:31,Trae Young makes 7-foot two point shot,56,55,Hawks
1:18,Cason Wallace misses 24-foot three point jumper,56,55,Thunder
1:13,Trae Young defensive rebound,56,55,Hawks
1:03,Trae Young bad pass (Isaiah Hartenstein steals),56,55,Hawks
50.6,Luguentz Dort makes 13-foot step back jumpshot,58,55,Thunder
30.2,Dyson Daniels misses layup,58,55,Hawks
27.9,Isaiah Hartenstein defensive rebound,58,55,Thunder
19.4,Shai Gilgeous-Alexander makes driving layup,60,55,Thunder
5.7,Mouhamed Gueye misses 22-foot three point jumper,60,55,Hawks
2.7,Onyeka Okongwu offensive rebound,60,55,Hawks
0.5,Nickeil Alexander-Walker misses 25-foot three point pullup jump shot,60,55,Hawks
0.1,Hawks offensive team rebound,60,55,Hawks
0.0,End of the 2nd Quarter,60,55,Unknown
,[ QUARTER 2 ENDED ],,,
12:00,Chet Holmgren enters the game for Aaron Wiggins,60,55,Thunder
11:47,Mouhamed Gueye personal foul,60,55,Hawks
11:41,Cason Wallace bad pass (Nickeil Alexander-Walker steals),60,55,Thunder
11:36,Nickeil Alexander-Walker bad pass (Chet Holmgren steals),60,55,Hawks
11:28,Shai Gilgeous-Alexander makes 13-foot pullup jump shot,62,55,Thunder
11:03,Onyeka Okongwu misses 23-foot three point jumper,62,55,Hawks
11:02,Hawks offensive team rebound,62,55,Hawks
11:02,Shai Gilgeous-Alexander loose ball foul,62,55,Thunder
10:54,Trae Young misses driving floating jump shot,62,55,Hawks
10:52,Chet Holmgren defensive rebound,62,55,Thunder
10:43,Shai Gilgeous-Alexander makes 12-foot pullup jump shot,64,55,Thunder
10:43,Trae Young shooting foul,64,55,Hawks
10:43,(10:43) [Thunder] REF-INITIATED REVIEW (REPLAY SUPPORTS CALL),64,55,Unknown
10:43,Shai Gilgeous-Alexander makes free throw 1 of 1,65,55,Thunder
10:20,Trae Young bad pass (Luguentz Dort steals),65,55,Hawks
9:55,Mouhamed Gueye blocks Chet Holmgren 's 26-foot three point pullup jump shot,65,55,Thunder
9:52,Mouhamed Gueye defensive rebound,65,55,Hawks
9:49,Mouhamed Gueye bad pass (Cason Wallace steals),65,55,Hawks
9:41,Chet Holmgren makes 25-foot three point jumper (Shai Gilgeous-Alexander assists),68,55,Thunder
9:31,Chet Holmgren shooting foul,68,55,Thunder
9:31,Dyson Daniels makes free throw 1 of 2,68,56,Hawks
9:31,Aaron Wiggins enters the game for Cason Wallace,68,56,Thunder
9:31,Dyson Daniels makes free throw 2 of 2,68,57,Hawks
9:20,Onyeka Okongwu personal foul,68,57,Hawks
9:13,Aaron Wiggins misses 25-foot three point pullup jump shot,68,57,Thunder
9:11,Thunder offensive team rebound,68,57,Thunder
9:11,Mouhamed Gueye loose ball foul,68,57,Hawks
8:57,Luguentz Dort makes 22-foot three point jumper (Shai Gilgeous-Alexander assists),71,57,Thunder
8:39,Nickeil Alexander-Walker makes 25-foot three point jumper (Onyeka Okongwu assists),71,60,Hawks
8:27,Shai Gilgeous-Alexander misses 11-foot two point shot,71,60,Thunder
8:25,Luguentz Dort offensive rebound,71,60,Thunder
8:22,Onyeka Okongwu shooting foul,71,60,Hawks
8:22,Chet Holmgren makes free throw 1 of 2,72,60,Thunder
8:22,Chet Holmgren makes free throw 2 of 2,73,60,Thunder
8:10,Mouhamed Gueye makes 23-foot three point jumper (Onyeka Okongwu assists),73,63,Hawks
7:54,Aaron Wiggins bad pass (Nickeil Alexander-Walker steals),73,63,Thunder
7:48,Trae Young bad pass (Chet Holmgren steals),73,63,Hawks
7:44,Dyson Daniels personal foul,73,63,Hawks
7:44,Chet Holmgren makes free throw 1 of 2,74,63,Thunder
7:44,Chet Holmgren makes free throw 2 of 2,75,63,Thunder
7:35,Onyeka Okongwu makes 1-foot alley oop dunk shot (Trae Young assists),75,65,Hawks
7:22,Luguentz Dort misses 22-foot three point jumper,75,65,Thunder
7:20,Aaron Wiggins offensive rebound,75,65,Thunder
7:09,Aaron Wiggins misses driving floating jump shot,75,65,Thunder
7:05,Chet Holmgren offensive rebound,75,65,Thunder
6:59,Shai Gilgeous-Alexander makes 25-foot three point step back jumpshot,78,65,Thunder
6:44,Trae Young misses driving floating jump shot,78,65,Hawks
6:40,Chet Holmgren defensive rebound,78,65,Thunder
6:31,Aaron Wiggins misses 22-foot three point jumper,78,65,Thunder
6:28,Onyeka Okongwu defensive rebound,78,65,Hawks
6:21,Dyson Daniels bad pass (Isaiah Hartenstein steals),78,65,Hawks
6:12,Shai Gilgeous-Alexander makes 12-foot jumper (Luguentz Dort assists),80,65,Thunder
6:11,Hawks Full timeout,80,65,Hawks
6:11,Vit Krejci enters the game for Dyson Daniels,80,65,Hawks
6:11,Luke Kennard enters the game for Trae Young,80,65,Hawks
6:11,Ajay Mitchell enters the game for Luguentz Dort,80,65,Thunder
5:53,Mouhamed Gueye makes 3-foot two point shot (Nickeil Alexander-Walker assists),80,67,Hawks
5:38,Aaron Wiggins makes 2-foot two point shot (Isaiah Hartenstein assists),82,67,Thunder
5:27,Nickeil Alexander-Walker bad pass (Ajay Mitchell steals),82,67,Hawks
5:23,Ajay Mitchell makes two point shot,84,67,Thunder
5:09,Aaron Wiggins shooting foul,84,67,Thunder
5:09,Nickeil Alexander-Walker makes free throw 1 of 2,84,68,Hawks
5:09,Asa Newell enters the game for Mouhamed Gueye,84,68,Hawks
5:09,Jaylin Williams enters the game for Isaiah Hartenstein,84,68,Thunder
5:09,Nickeil Alexander-Walker makes free throw 2 of 2,84,69,Hawks
4:56,Ajay Mitchell misses 20-foot step back jumpshot,84,69,Thunder
4:52,Thunder offensive team rebound,84,69,Thunder
4:45,Ajay Mitchell misses driving layup,84,69,Thunder
4:43,Aaron Wiggins offensive rebound,84,69,Thunder
4:41,Jaylin Williams makes 25-foot three point jumper (Aaron Wiggins assists),87,69,Thunder
4:22,Luke Kennard misses 23-foot three point jumper,87,69,Hawks
4:18,Chet Holmgren defensive rebound,87,69,Thunder
4:10,Shai Gilgeous-Alexander makes driving layup,89,69,Thunder
3:56,Luke Kennard makes 11-foot pullup jump shot,89,71,Hawks
3:43,Chet Holmgren traveling,89,71,Thunder
3:43,Dyson Daniels enters the game for Nickeil Alexander-Walker,89,71,Hawks
3:43,Trae Young enters the game for Vit Krejci,89,71,Hawks
3:43,Brooks Barnhizer enters the game for Chet Holmgren,89,71,Thunder
3:33,Asa Newell makes 22-foot three point jumper (Luke Kennard assists),89,74,Hawks
3:22,Asa Newell personal foul,89,74,Hawks
3:22,Shai Gilgeous-Alexander makes free throw 1 of 2,90,74,Thunder
3:22,N'Faly Dante enters the game for Onyeka Okongwu,90,74,Hawks
3:22,Cason Wallace enters the game for Aaron Wiggins,90,74,Thunder
3:22,Shai Gilgeous-Alexander makes free throw 2 of 2,91,74,Thunder
3:01,Luke Kennard misses 23-foot three point jumper,91,74,Hawks
2:59,Asa Newell offensive rebound,91,74,Hawks
2:57,Luke Kennard makes 25-foot three point jumper (Asa Newell assists),91,77,Hawks
2:56,Thunder Full timeout,91,77,Thunder
2:36,Jaylin Williams misses 23-foot three point jumper,91,77,Thunder
2:33,Dyson Daniels defensive rebound,91,77,Hawks
2:22,Thunder Coach's Challenge,91,77,Thunder
2:22,(02:22) [Thunder] COACH'S CHALLENGE (CALL OVERTURNED) [Thunder] retain their timeout,91,77,Thunder
2:22,Cason Wallace blocks Asa Newell 's 2-foot dunk,91,77,Hawks
2:22,Jaylin Williams defensive rebound,91,77,Thunder
2:22,Onyeka Okongwu enters the game for N'Faly Dante,91,77,Hawks
2:01,Jaylin Williams misses 25-foot three point jumper,91,77,Thunder
1:59,Ajay Mitchell offensive rebound,91,77,Thunder
1:53,Shai Gilgeous-Alexander out of bounds lost ball turnover,91,77,Thunder
1:33,Asa Newell makes 23-foot three point jumper (Dyson Daniels assists),91,80,Hawks
1:10,Shai Gilgeous-Alexander makes 25-foot three point jumper (Ajay Mitchell assists),94,80,Thunder
53.6,Luke Kennard lost ball turnover (Shai Gilgeous-Alexander steals),94,80,Hawks
46.1,Ajay Mitchell makes 22-foot three point shot (Shai Gilgeous-Alexander assists),97,80,Thunder
32.5,Asa Newell offensive foul,97,80,Hawks
32.5,Asa Newell turnover,97,80,Hawks
32.5,Chris Youngblood enters the game for Brooks Barnhizer,97,80,Thunder
26.8,Ajay Mitchell makes 4-foot two point shot,99,80,Thunder
21.4,Cason Wallace personal foul,99,80,Thunder
21.4,Luguentz Dort enters the game for Chris Youngblood,99,80,Thunder
14.7,Dyson Daniels misses driving floating jump shot,99,80,Hawks
12.0,Ajay Mitchell defensive rebound,99,80,Thunder
12.0,Chris Youngblood enters the game for Luguentz Dort,99,80,Thunder
2.8,Ajay Mitchell misses 25-foot three point jumper,99,80,Thunder
2.8,Onyeka Okongwu defensive rebound,99,80,Hawks
0.0,End of the 3rd Quarter,99,80,Unknown
,[ QUARTER 3 ENDED ],,,
12:00,Keaton Wallace enters the game for Dyson Daniels,99,80,Hawks
12:00,Vit Krejci enters the game for Trae Young,99,80,Hawks
12:00,Isaiah Hartenstein enters the game for Shai Gilgeous-Alexander,99,80,Thunder
12:00,Chet Holmgren enters the game for Jaylin Williams,99,80,Thunder
12:00,Aaron Wiggins enters the game for Cason Wallace,99,80,Thunder
12:00,Luguentz Dort enters the game for Chris Youngblood,99,80,Thunder
11:47,Vit Krejci misses 25-foot three point jumper,99,80,Hawks
11:44,Isaiah Hartenstein defensive rebound,99,80,Thunder
11:28,Luguentz Dort misses layup,99,80,Thunder
11:25,Asa Newell defensive rebound,99,80,Hawks
11:18,Asa Newell misses 23-foot three point jumper,99,80,Hawks
11:15,Isaiah Hartenstein defensive rebound,99,80,Thunder
11:01,Isaiah Hartenstein misses 5-foot two point shot,99,80,Thunder
10:57,Asa Newell defensive rebound,99,80,Hawks
10:53,Luke Kennard misses 25-foot three point jumper,99,80,Hawks
10:50,Chet Holmgren defensive rebound,99,80,Thunder
10:37,Isaiah Hartenstein misses 22-foot three point jumper,99,80,Thunder
10:34,Onyeka Okongwu defensive rebound,99,80,Hawks
10:32,Keaton Wallace lost ball turnover (Chet Holmgren steals),99,80,Hawks
10:29,Onyeka Okongwu shooting foul,99,80,Hawks
10:29,Chet Holmgren makes free throw 1 of 2,100,80,Thunder
10:29,Trae Young enters the game for Keaton Wallace,100,80,Hawks
10:29,Isaiah Hartenstein turnover (lane violation),100,80,Thunder
10:12,Vit Krejci misses 22-foot three point jumper,100,80,Hawks
10:08,Asa Newell offensive rebound,100,80,Hawks
10:08,Asa Newell makes 1-foot driving dunk,100,82,Hawks
9:52,Isaiah Hartenstein makes 1-foot dunk (Ajay Mitchell assists),102,82,Thunder
9:40,Trae Young misses 19-foot pullup jump shot,102,82,Hawks
9:37,Aaron Wiggins defensive rebound,102,82,Thunder
9:24,Isaiah Hartenstein misses 13-foot two point shot,102,82,Thunder
9:23,Thunder offensive team rebound,102,82,Thunder
9:23,Asa Newell loose ball foul,102,82,Hawks
9:23,Nickeil Alexander-Walker enters the game for Luke Kennard,102,82,Hawks
9:08,Ajay Mitchell makes 4-foot two point shot,104,82,Thunder
8:58,Vit Krejci misses 25-foot three point jumper,104,82,Hawks
8:56,Asa Newell offensive rebound,104,82,Hawks
8:47,Trae Young makes 7-foot two point shot (Vit Krejci assists),104,84,Hawks
8:32,Onyeka Okongwu defensive 3-seconds (technical foul),104,84,Hawks
8:32,Chet Holmgren misses technical free throw,104,84,Thunder
8:32,Thunder offensive team rebound,104,84,Thunder
8:20,Isaiah Hartenstein misses layup,104,84,Thunder
8:17,Chet Holmgren offensive rebound,104,84,Thunder
8:17,Chet Holmgren makes tip shot,106,84,Thunder
8:06,Asa Newell misses 23-foot three point jumper,106,84,Hawks
8:01,Ajay Mitchell defensive rebound,106,84,Thunder
7:50,Trae Young personal foul,106,84,Hawks
7:44,Isaiah Hartenstein offensive goaltending turnover,106,84,Thunder
7:37,Vit Krejci makes 24-foot three point jumper (Trae Young assists),106,87,Hawks
7:20,Ajay Mitchell misses 16-foot pullup jump shot,106,87,Thunder
7:15,Aaron Wiggins offensive rebound,106,87,Thunder
7:15,Aaron Wiggins misses tip shot,106,87,Thunder
7:15,Trae Young defensive rebound,106,87,Hawks
7:09,Nickeil Alexander-Walker misses 25-foot three point jumper,106,87,Hawks
7:06,Chet Holmgren defensive rebound,106,87,Thunder
6:53,Ajay Mitchell misses driving layup,106,87,Thunder
6:51,Isaiah Hartenstein offensive rebound,106,87,Thunder
6:50,Chet Holmgren makes 25-foot three point jumper (Isaiah Hartenstein assists),109,87,Thunder
6:37,Trae Young bad pass (Ajay Mitchell steals),109,87,Hawks
6:32,Vit Krejci personal foul,109,87,Hawks
6:32,Hawks Full timeout,109,87,Hawks
6:32,Mouhamed Gueye enters the game for Onyeka Okongwu,109,87,Hawks
