time,description,home_score,away_score,team
12:00,Nic Claxton vs. Alperen Sengun (Michael Porter Jr. gains possession),0,0,Nets
11:37,Terance Mann makes driving floating jump shot (Nic Claxton assists),2,0,Nets
11:10,Alperen Sengun makes driving layup (Amen Thompson assists),0,2,Rockets
10:53,Terance Mann makes 26-foot three pointer (Nic Claxton assists),3,2,Nets
10:29,Josh Okogie misses driving layup,3,2,Rockets
10:26,Michael Porter Jr. defensive rebound,3,2,Nets
10:22,Michael Porter Jr. makes layup,5,2,Nets
10:11,Terance Mann personal foul,5,2,Nets
10:03,Amen Thompson misses 23-foot three point jumper,5,2,Rockets
10:03,Rockets offensive team rebound,5,2,Rockets
10:03,Nic Claxton loose ball foul,5,2,Nets
9:56,Kevin Durant makes 5-foot two point shot (Alperen Sengun assists),7,4,Rockets
9:36,Terance Mann misses 24-foot three point jumper,7,4,Nets
9:35,Amen Thompson defensive rebound,7,4,Rockets
9:28,Alperen Sengun makes 2-foot dunk (Amen Thompson assists),7,6,Rockets
9:28,Ben Saraf shooting foul,7,6,Nets
9:28,Alperen Sengun makes free throw 1 of 1,7,7,Rockets
9:20,Amen Thompson personal foul,7,7,Rockets
9:15,Terance Mann makes 3-foot two point shot,9,7,Nets
8:54,Kevin Durant makes driving layup,9,9,Rockets
8:48,Nic Claxton makes 1-foot alley oop dunk shot (Ben Saraf assists),11,9,Nets
8:32,Kevin Durant misses 26-foot three point jumper,11,9,Rockets
8:28,Terance Mann defensive rebound,11,9,Nets
8:23,Michael Porter Jr. misses driving layup,11,9,Nets
8:22,Michael Porter Jr. offensive rebound,11,9,Nets
8:22,Michael Porter Jr. makes two point shot,13,9,Nets
8:08,Amen Thompson makes 1-foot driving dunk,13,11,Rockets
7:52,Ben Saraf misses driving layup,13,11,Nets
7:51,Kevin Durant defensive rebound,13,11,Rockets
7:42,Amen Thompson makes 1-foot driving dunk,13,13,Rockets
7:27,Amen Thompson personal foul,13,13,Rockets
7:27,Tari Eason enters the game for Amen Thompson,13,13,Rockets
7:20,Michael Porter Jr. misses 26-foot three point step back jumpshot,13,13,Nets
7:19,Tari Eason defensive rebound,13,13,Rockets
7:12,Kevin Durant misses driving layup,13,13,Rockets
7:10,Alperen Sengun offensive rebound,13,13,Rockets
6:59,Josh Okogie makes 26-foot three point jumper (Tari Eason assists),13,16,Rockets
6:33,Terance Mann makes 25-foot three point jumper (Nic Claxton assists),16,16,Nets
6:16,Michael Porter Jr. personal foul,16,16,Nets
6:16,Rockets Full timeout,16,16,Rockets
6:16,Steven Adams enters the game for Alperen Sengun,16,16,Rockets
6:09,Kevin Durant misses 25-foot three point pullup jump shot,16,16,Rockets
6:07,Steven Adams offensive rebound,16,16,Rockets
6:03,Tari Eason misses 17-foot jumper,16,16,Rockets
6:03,Jabari Smith Jr. offensive rebound,16,16,Rockets
6:01,Jabari Smith Jr. makes two point shot,16,18,Rockets
6:01,Nic Claxton defensive goaltending violation,16,18,Nets
5:45,Ben Saraf misses 25-foot three point jumper,16,18,Nets
5:41,Tari Eason defensive rebound,16,18,Rockets
5:37,Tari Eason makes 3-foot two point shot,16,20,Rockets
5:37,Terance Mann shooting foul,16,20,Nets
5:37,Jalen Wilson enters the game for Terance Mann,16,20,Nets
5:37,Tari Eason misses free throw 1 of 1,16,20,Rockets
5:37,Rockets offensive team rebound,16,20,Rockets
5:37,Nic Claxton loose ball foul,16,20,Nets
5:37,Steven Adams makes free throw 1 of 2,16,21,Rockets
5:37,Day'Ron Sharpe enters the game for Nic Claxton,16,21,Nets
5:37,Steven Adams makes free throw 2 of 2,16,22,Rockets
5:19,Ben Saraf makes 24-foot three point jumper (Cam Thomas assists),19,22,Nets
5:07,Jalen Wilson personal foul,19,22,Nets
5:07,Kevin Durant makes free throw 1 of 2,19,23,Rockets
5:07,Nolan Traore enters the game for Michael Porter Jr.,19,23,Nets
5:07,Noah Clowney enters the game for Ben Saraf,19,23,Nets
5:07,Kevin Durant makes free throw 2 of 2,19,24,Rockets
4:42,shot clock turnover,19,24,Nets
4:30,Josh Okogie makes 26-foot three point jumper (Kevin Durant assists),19,27,Rockets
4:07,Nolan Traore misses two point shot,19,27,Nets
4:05,Steven Adams defensive rebound,19,27,Rockets
3:55,Kevin Durant misses 7-foot two point shot,19,27,Rockets
3:53,Jalen Wilson defensive rebound,19,27,Nets
3:48,Jalen Wilson misses 24-foot three point jumper,19,27,Nets
3:44,Noah Clowney offensive rebound,19,27,Nets
3:40,Jalen Wilson misses 24-foot three point jumper,19,27,Nets
3:37,Kevin Durant defensive rebound,19,27,Rockets
3:35,Reed Sheppard enters the game for Jabari Smith Jr.,19,27,Rockets
3:35,Tyrese Martin enters the game for Cam Thomas,19,27,Nets
3:28,Tari Eason misses 25-foot three point pullup jump shot,19,27,Rockets
3:25,Day'Ron Sharpe defensive rebound,19,27,Nets
3:12,Tyrese Martin makes 22-foot three point jumper (Nolan Traore assists),22,27,Nets
2:57,Kevin Durant misses 17-foot pullup jump shot,22,27,Rockets
2:55,Day'Ron Sharpe defensive rebound,22,27,Nets
2:48,Day'Ron Sharpe makes 24-foot three point jumper (Jalen Wilson assists),25,27,Nets
2:33,Kevin Durant makes 3-foot driving dunk (Reed Sheppard assists),25,29,Rockets
2:33,Nets Full timeout,25,29,Nets
2:33,Alperen Sengun enters the game for Kevin Durant,25,29,Rockets
2:33,Amen Thompson enters the game for Josh Okogie,25,29,Rockets
2:20,Nolan Traore bad pass (Amen Thompson steals),25,29,Nets
1:59,Day'Ron Sharpe shooting foul,25,29,Nets
1:59,Steven Adams makes free throw 1 of 2,25,30,Rockets
1:59,Steven Adams makes free throw 2 of 2,25,31,Rockets
1:49,Tyrese Martin misses 27-foot three point jumper,25,31,Nets
1:46,Amen Thompson defensive rebound,25,31,Rockets
1:42,Reed Sheppard makes 24-foot three point shot (Amen Thompson assists),25,34,Rockets
1:16,Steven Adams blocks Noah Clowney 's 23-foot three point jumper,25,34,Nets
1:16,Nets offensive team rebound,25,34,Nets
1:16,shot clock turnover,25,34,Nets
1:00,Alperen Sengun makes 3-foot layup (Steven Adams assists),25,36,Rockets
50.2,Noah Clowney misses 23-foot jumper,25,36,Nets
47.5,Tyrese Martin offensive rebound,25,36,Nets
41.2,Jalen Wilson misses 24-foot three point jumper,25,36,Nets
38.8,Tari Eason defensive rebound,25,36,Rockets
30.5,Tari Eason makes 22-foot three point jumper (Amen Thompson assists),25,39,Rockets
14.8,Tyrese Martin misses 26-foot three point jumper,25,39,Nets
13.1,Reed Sheppard defensive rebound,25,39,Rockets
2.5,Tari Eason makes 26-foot three point jumper (Alperen Sengun assists),25,42,Rockets
0.0,Nolan Traore misses heave jump shot,25,42,Nets
0.0,Nets offensive team rebound,25,42,Nets
0.0,End of the 1st Quarter,25,42,Unknown
,[ QUARTER 1 ENDED ],,,
12:00,Josh Okogie enters the game for Steven Adams,25,42,Rockets
12:00,Clint Capela enters the game for Amen Thompson,25,42,Rockets
12:00,Michael Porter Jr. enters the game for Jalen Wilson,25,42,Nets
12:00,Ben Saraf enters the game for Nolan Traore,25,42,Nets
11:40,Reed Sheppard misses 27-foot three point jumper,25,42,Rockets
11:36,Reed Sheppard offensive rebound,25,42,Rockets
11:33,Clint Capela makes 1-foot two point shot (Tari Eason assists),25,44,Rockets
11:20,Noah Clowney misses 25-foot three point jumper,25,44,Nets
11:17,Tari Eason defensive rebound,25,44,Rockets
11:10,Ben Saraf shooting foul,25,44,Nets
11:10,Tari Eason makes free throw 1 of 2,25,45,Rockets
11:10,Tari Eason misses free throw 2 of 2,25,45,Rockets
11:09,Nets defensive team rebound,25,45,Nets
11:00,Michael Porter Jr. makes 24-foot three point jumper (Ben Saraf assists),28,45,Nets
10:42,Alperen Sengun misses driving layup,28,45,Rockets
10:39,Day'Ron Sharpe defensive rebound,28,45,Nets
10:26,Clint Capela blocks Noah Clowney 's 1-foot dunk,28,45,Nets
10:23,Reed Sheppard defensive rebound,28,45,Rockets
10:21,Tari Eason makes 25-foot three point shot (Alperen Sengun assists),28,48,Rockets
10:03,Michael Porter Jr. makes 24-foot three point jumper (Ben Saraf assists),31,48,Nets
9:44,Clint Capela makes 2-foot two point shot (Tari Eason assists),31,50,Rockets
9:33,Clint Capela shooting foul,31,50,Rockets
9:33,Day'Ron Sharpe makes free throw 1 of 2,32,50,Nets
9:33,Jalen Wilson enters the game for Noah Clowney,32,50,Nets
9:33,Day'Ron Sharpe misses free throw 2 of 2,32,50,Nets
9:33,Alperen Sengun lane violation,32,50,Rockets
9:32,Tyrese Martin offensive rebound,32,50,Nets
9:32,Josh Okogie personal foul,32,50,Rockets
9:32,Nic Claxton enters the game for Day'Ron Sharpe,32,50,Nets
9:22,Michael Porter Jr. makes driving layup (Ben Saraf assists),34,50,Nets
9:07,Reed Sheppard lost ball turnover (Ben Saraf steals),34,50,Rockets
9:03,Tyrese Martin makes dunk (Michael Porter Jr. assists),36,50,Nets
9:03,Rockets Full timeout,36,50,Rockets
9:03,Kevin Durant enters the game for Alperen Sengun,36,50,Rockets
8:55,Tari Eason makes 22-foot three point jumper (Reed Sheppard assists),36,53,Rockets
8:41,Jalen Wilson makes 23-foot three point jumper (Michael Porter Jr. assists),39,53,Nets
8:15,Reed Sheppard misses 20-foot pullup jump shot,39,53,Rockets
8:12,Nic Claxton defensive rebound,39,53,Nets
8:03,Tyrese Martin makes 24-foot three point jumper (Ben Saraf assists),42,53,Nets
7:45,Tari Eason makes 3-foot two point shot,42,55,Rockets
7:24,Ben Saraf makes 28-foot three point jumper (Jalen Wilson assists),45,55,Nets
7:13,Reed Sheppard misses 23-foot three point jumper,45,55,Rockets
7:09,Tyrese Martin defensive rebound,45,55,Nets
7:05,Reed Sheppard personal foul,45,55,Rockets
7:05,Amen Thompson enters the game for Reed Sheppard,45,55,Rockets
7:05,Jabari Smith Jr. enters the game for Tari Eason,45,55,Rockets
6:59,Tyrese Martin misses 24-foot three point jumper,45,55,Nets
6:55,Jabari Smith Jr. defensive rebound,45,55,Rockets
6:50,Kevin Durant misses 23-foot three point shot,45,55,Rockets
6:46,Ben Saraf defensive rebound,45,55,Nets
6:33,Clint Capela blocks Ben Saraf 's 1-foot two point shot,45,55,Nets
6:31,Kevin Durant defensive rebound,45,55,Rockets
6:24,Amen Thompson makes 1-foot dunk (Kevin Durant assists),45,57,Rockets
6:08,Nic Claxton makes driving layup,47,57,Nets
6:08,Clint Capela shooting foul,47,57,Rockets
6:08,Alperen Sengun enters the game for Josh Okogie,47,57,Rockets
6:08,Steven Adams enters the game for Clint Capela,47,57,Rockets
6:08,Terance Mann enters the game for Tyrese Martin,47,57,Nets
6:08,Cam Thomas enters the game for Michael Porter Jr.,47,57,Nets
6:08,Terance Mann misses free throw 1 of 1,47,57,Nets
6:08,Kevin Durant defensive rebound,47,57,Rockets
5:46,Kevin Durant misses 9-foot two point shot,47,57,Rockets
5:45,Steven Adams offensive rebound,47,57,Rockets
5:44,Steven Adams traveling,47,57,Rockets
5:28,Cam Thomas makes 25-foot three point step back jumpshot,50,57,Nets
5:11,Alperen Sengun makes 8-foot driving floating jump shot,50,59,Rockets
5:01,Ben Saraf misses 24-foot three point pullup jump shot,50,59,Nets
4:58,Jabari Smith Jr. defensive rebound,50,59,Rockets
4:48,Jabari Smith Jr. makes 22-foot three point jumper (Alperen Sengun assists),50,62,Rockets
4:29,Cam Thomas bad pass (Jabari Smith Jr. steals),50,62,Nets
4:20,Kevin Durant offensive foul,50,62,Rockets
4:20,Kevin Durant turnover,50,62,Rockets
4:20,Nolan Traore enters the game for Ben Saraf,50,62,Nets
4:04,Kevin Durant shooting foul,50,62,Rockets
4:04,Terance Mann makes free throw 1 of 2,51,62,Nets
4:04,Terance Mann makes free throw 2 of 2,52,62,Nets
3:48,Amen Thompson misses 10-foot pullup jump shot,52,62,Rockets
3:46,Steven Adams offensive rebound,52,62,Rockets
3:43,Amen Thompson misses 13-foot two point shot,52,62,Rockets
3:39,Nolan Traore defensive rebound,52,62,Nets
3:27,Alperen Sengun kicked ball violation,52,62,Rockets
3:27,Michael Porter Jr. enters the game for Jalen Wilson,52,62,Nets
3:20,Cam Thomas misses driving floating jump shot,52,62,Nets
3:19,Nic Claxton offensive rebound,52,62,Nets
3:18,Nic Claxton misses tip shot,52,62,Nets
3:16,Steven Adams defensive rebound,52,62,Rockets
3:12,Nolan Traore shooting foul,52,62,Nets
3:12,Kevin Durant makes free throw 1 of 2,52,63,Rockets
3:12,Kevin Durant makes free throw 2 of 2,52,64,Rockets
2:56,Nic Claxton makes driving layup,54,64,Nets
2:39,Alperen Sengun misses driving floating jump shot,54,64,Rockets
2:39,Terance Mann defensive rebound,54,64,Nets
2:33,Nolan Traore misses 23-foot three point shot,54,64,Nets
2:29,Steven Adams defensive rebound,54,64,Rockets
2:24,Jabari Smith Jr. misses 25-foot three point shot,54,64,Rockets
2:22,Cam Thomas defensive rebound,54,64,Nets
2:11,Cam Thomas makes 8-foot driving floating jump shot,56,64,Nets
2:11,Kevin Durant shooting foul,56,64,Rockets
2:11,Nets Full timeout,56,64,Nets
2:11,Josh Okogie enters the game for Kevin Durant,56,64,Rockets
2:11,Tari Eason enters the game for Steven Adams,56,64,Rockets
2:11,Cam Thomas misses free throw 1 of 1,56,64,Nets
2:11,Alperen Sengun defensive rebound,56,64,Rockets
1:55,Jabari Smith Jr. misses 22-foot three point jumper,56,64,Rockets
1:54,Rockets offensive team rebound,56,64,Rockets
1:46,Jabari Smith Jr. misses two point shot,56,64,Rockets
1:44,Alperen Sengun offensive rebound,56,64,Rockets
1:42,Tari Eason makes 22-foot three point jumper (Alperen Sengun assists),56,67,Rockets
1:21,Cam Thomas misses driving layup,56,67,Nets
1:20,Terance Mann offensive rebound,56,67,Nets
1:20,Terance Mann makes dunk,58,67,Nets
54.0,Amen Thompson misses 9-foot two point shot,58,67,Rockets
51.2,Michael Porter Jr. defensive rebound,58,67,Nets
48.6,Cam Thomas misses 25-foot three point shot,58,67,Nets
47.6,Amen Thompson defensive rebound,58,67,Rockets
32.1,Amen Thompson makes 2-foot dunk (Josh Okogie assists),58,69,Rockets
9.8,Michael Porter Jr. makes 23-foot pullup jump shot,60,69,Nets
6.8,Nolan Traore personal foul,60,69,Nets
6.8,Kevin Durant enters the game for Josh Okogie,60,69,Rockets
6.8,Tyrese Martin enters the game for Michael Porter Jr.,60,69,Nets
6.8,Jalen Wilson enters the game for Cam Thomas,60,69,Nets
6.8,Noah Clowney enters the game for Nolan Traore,60,69,Nets
2.5,Kevin Durant makes 8-foot driving floating jump shot,60,71,Rockets
0.0,Terance Mann misses heave jump shot,60,71,Nets
0.0,Nets offensive team rebound,60,71,Nets
0.0,End of the 2nd Quarter,60,71,Unknown
,[ QUARTER 2 ENDED ],,,
12:00,Josh Okogie enters the game for Tari Eason,60,71,Rockets
12:00,Ben Saraf enters the game for Tyrese Martin,60,71,Nets
12:00,Michael Porter Jr. enters the game for Jalen Wilson,60,71,Nets
12:00,Cam Thomas enters the game for Noah Clowney,60,71,Nets
11:46,Kevin Durant misses 24-foot three point jumper,60,71,Rockets
11:45,Rockets offensive team rebound,60,71,Rockets
11:45,Nic Claxton loose ball foul,60,71,Nets
11:39,Alperen Sengun misses 3-foot two point shot,60,71,Rockets
11:38,Rockets offensive team rebound,60,71,Rockets
11:38,Michael Porter Jr. loose ball foul,60,71,Nets
11:30,Jabari Smith Jr. makes 13-foot pullup jump shot (Kevin Durant assists),60,73,Rockets
11:11,Terance Mann misses 6-foot two point shot,60,73,Nets
11:09,Alperen Sengun defensive rebound,60,73,Rockets
11:03,Alperen Sengun makes 27-foot three point jumper (Amen Thompson assists),60,76,Rockets
10:42,Ben Saraf misses 5-foot two point shot,60,76,Nets
10:41,Terance Mann offensive rebound,60,76,Nets
10:41,Terance Mann makes tip shot,62,76,Nets
10:23,Josh Okogie makes 2-foot dunk (Amen Thompson assists),62,78,Rockets
10:23,Nets Full timeout,62,78,Nets
10:09,Cam Thomas misses 16-foot step back jumpshot,62,78,Nets
10:05,Kevin Durant defensive rebound,62,78,Rockets
9:51,Jabari Smith Jr. makes driving layup,62,80,Rockets
9:38,Michael Porter Jr. misses driving layup,62,80,Nets
9:35,Alperen Sengun defensive rebound,62,80,Rockets
9:32,Nic Claxton shooting foul,62,80,Nets
9:32,Alperen Sengun makes free throw 1 of 2,62,81,Rockets
9:32,Day'Ron Sharpe enters the game for Nic Claxton,62,81,Nets
9:32,Alperen Sengun makes free throw 2 of 2,62,82,Rockets
9:13,Day'Ron Sharpe makes 6-foot two point shot,64,82,Nets
8:56,Alperen Sengun out of bounds lost ball turnover,64,82,Rockets
8:37,Ben Saraf bad pass (Jabari Smith Jr. steals),64,82,Nets
8:31,Kevin Durant makes 2-foot layup (Amen Thompson assists),64,84,Rockets
8:31,Day'Ron Sharpe shooting foul,64,84,Nets
8:31,Jalen Wilson enters the game for Terance Mann,64,84,Nets
8:31,Tyrese Martin enters the game for Ben Saraf,64,84,Nets
8:31,Kevin Durant makes free throw 1 of 1,64,85,Rockets
8:15,Cam Thomas misses 18-foot two point shot,64,85,Nets
8:12,Day'Ron Sharpe offensive rebound,64,85,Nets
8:11,Day'Ron Sharpe makes two point shot,66,85,Nets
7:56,Alperen Sengun bad pass (Cam Thomas steals),66,85,Rockets
7:56,Amen Thompson personal foul,66,85,Rockets
7:32,Day'Ron Sharpe makes 1-foot layup (Tyrese Martin assists),68,85,Nets
7:15,Kevin Durant makes 10-foot pullup jump shot,68,87,Rockets
7:00,Cam Thomas bad pass (Kevin Durant steals),68,87,Nets
6:37,Josh Okogie misses two point shot,68,87,Rockets
6:35,Tyrese Martin defensive rebound,68,87,Nets
6:28,Michael Porter Jr. misses 23-foot three point jumper,68,87,Nets
6:26,Jabari Smith Jr. defensive rebound,68,87,Rockets
6:19,Day'Ron Sharpe shooting foul,68,87,Nets
6:19,Jabari Smith Jr. makes free throw 1 of 2,68,88,Rockets
6:19,Steven Adams enters the game for Amen Thompson,68,88,Rockets
6:19,Tari Eason enters the game for Alperen Sengun,68,88,Rockets
6:19,Noah Clowney enters the game for Michael Porter Jr.,68,88,Nets
6:19,Jabari Smith Jr. makes free throw 2 of 2,68,89,Rockets
5:54,Cam Thomas misses driving floating jump shot,68,89,Nets
5:52,Kevin Durant defensive rebound,68,89,Rockets
5:45,Day'Ron Sharpe personal foul,68,89,Nets
5:45,Josh Okogie makes free throw 1 of 2,68,90,Rockets
5:45,Josh Okogie makes free throw 2 of 2,68,91,Rockets
5:34,Tari Eason personal foul,68,91,Rockets
5:30,Josh Okogie personal foul,68,91,Rockets
5:21,Tyrese Martin misses driving floating jump shot,68,91,Nets
5:18,Tari Eason defensive rebound,68,91,Rockets
5:11,Cam Thomas shooting foul,68,91,Nets
5:11,Kevin Durant makes free throw 1 of 2,68,92,Rockets
5:11,Kevin Durant makes free throw 2 of 2,68,93,Rockets
4:58,Josh Okogie personal foul,68,93,Rockets
4:52,Day'Ron Sharpe makes driving layup (Cam Thomas assists),70,93,Nets
4:52,Tari Eason shooting foul,70,93,Rockets
4:52,Day'Ron Sharpe makes free throw 1 of 1,71,93,Nets
4:28,Tari Eason misses 21-foot pullup jump shot,71,93,Rockets
4:24,Steven Adams offensive rebound,71,93,Rockets
4:15,Kevin Durant lost ball turnover (Jalen Wilson steals),71,93,Rockets
4:08,Noah Clowney misses 25-foot three point jumper,71,93,Nets
4:04,Day'Ron Sharpe offensive rebound,71,93,Nets
3:57,Josh Okogie shooting foul,71,93,Rockets
3:57,Cam Thomas misses free throw 1 of 2,71,93,Nets
3:57,Nets offensive team rebound,71,93,Nets
3:57,Amen Thompson enters the game for Jabari Smith Jr.,71,93,Rockets
3:57,Reed Sheppard enters the game for Josh Okogie,71,93,Rockets
3:57,Cam Thomas makes free throw 2 of 2,72,93,Nets
3:38,Kevin Durant offensive foul,72,93,Rockets
3:38,Kevin Durant turnover,72,93,Rockets
3:38,Rockets Full timeout,72,93,Rockets
3:38,(03:38) [Rockets] COACH'S CHALLENGE (CALL STANDS) [Rockets] charged with a timeout,72,93,Rockets
3:38,Alperen Sengun enters the game for Kevin Durant,72,93,Rockets
3:15,Tyrese Martin misses 25-foot three point pullup jump shot,72,93,Nets
3:12,Amen Thompson defensive rebound,72,93,Rockets
3:02,Amen Thompson misses driving layup,72,93,Rockets
3:00,Steven Adams offensive rebound,72,93,Rockets
3:00,Steven Adams misses tip shot,72,93,Rockets
2:59,Day'Ron Sharpe defensive rebound,72,93,Nets
2:52,Cam Thomas makes 10-foot two point shot (Noah Clowney assists),74,93,Nets
2:51,Nets delay of game violation,74,93,Nets
2:35,Michael Porter Jr. enters the game for Tyrese Martin,74,93,Nets
2:35,Nolan Traore enters the game for Day'Ron Sharpe,74,93,Nets
2:29,Alperen Sengun misses 16-foot pullup jump shot,74,93,Rockets
2:26,Noah Clowney defensive rebound,74,93,Nets
2:12,Jalen Wilson bad pass (Reed Sheppard steals),74,93,Nets
2:07,Reed Sheppard makes 2-foot dunk,74,95,Rockets
2:03,Steven Adams shooting foul,74,95,Rockets
2:03,Cam Thomas misses free throw 1 of 2,74,95,Nets
2:03,Nets offensive team rebound,74,95,Nets
2:03,Terance Mann enters the game for Jalen Wilson,74,95,Nets
2:03,Cam Thomas makes free throw 2 of 2,75,95,Nets
1:44,Alperen Sengun makes layup,75,97,Rockets
1:25,Michael Porter Jr. misses 6-foot two point shot,75,97,Nets
1:23,Alperen Sengun defensive rebound,75,97,Rockets
1:09,Rockets Full timeout,75,97,Rockets
1:09,Tyrese Martin enters the game for Cam Thomas,75,97,Nets
1:05,Nolan Traore personal foul,75,97,Nets
1:05,Alperen Sengun makes free throw 1 of 2,75,98,Rockets
1:05,Alperen Sengun makes free throw 2 of 2,75,99,Rockets
1:05,Rockets delay of game violation,75,99,Rockets
51.2,Noah Clowney makes driving layup,77,99,Nets
39.4,Amen Thompson makes 2-foot layup (Alperen Sengun assists),77,101,Rockets
39.4,Nolan Traore shooting foul,77,101,Nets
39.4,Amen Thompson makes free throw 1 of 1,77,102,Rockets
29.9,Terance Mann misses 23-foot three point jumper,77,102,Nets
28.5,Rockets defensive team rebound,77,102,Rockets
28.5,Tyrese Martin loose ball foul,77,102,Nets
28.5,Amen Thompson misses free throw 1 of 2,77,102,Rockets
28.5,Rockets offensive team rebound,77,102,Rockets
28.5,Jabari Smith Jr. enters the game for Reed Sheppard,77,102,Rockets
28.5,Josh Okogie enters the game for Steven Adams,77,102,Rockets
28.5,Amen Thompson makes free throw 2 of 2,77,103,Rockets
21.9,Nolan Traore lost ball turnover (Josh Okogie steals),77,103,Nets
3.0,Tari Eason misses 23-foot three point jumper,77,103,Rockets
3.0,Michael Porter Jr. defensive rebound,77,103,Nets
0.0,Michael Porter Jr. misses heave jump shot,77,103,Nets
0.0,Nets offensive team rebound,77,103,Nets
0.0,End of the 3rd Quarter,77,103,Unknown
,[ QUARTER 3 ENDED ],,,
12:00,Reed Sheppard enters the game for Amen Thompson,77,103,Rockets
12:00,Clint Capela enters the game for Jabari Smith Jr.,77,103,Rockets
12:00,Nic Claxton enters the game for Noah Clowney,77,103,Nets
11:44,Nic Claxton offensive foul,77,103,Nets
11:44,Nic Claxton turnover,77,103,Nets
11:27,Alperen Sengun makes 25-foot three point jumper (Reed Sheppard assists),77,106,Rockets
11:13,Terance Mann makes 25-foot three pointer,80,106,Nets
11:00,Tyrese Martin personal foul,80,106,Nets
10:53,Clint Capela makes 1-foot alley oop dunk shot (Reed Sheppard assists),80,108,Rockets
10:29,Michael Porter Jr. makes 21-foot step back jumpshot (Tyrese Martin assists),82,108,Nets
10:12,Reed Sheppard out of bounds bad pass turnover,82,108,Rockets
10:00,Michael Porter Jr. lost ball turnover (Alperen Sengun steals),82,108,Nets
9:56,Reed Sheppard makes two point shot (Tari Eason assists),82,110,Rockets
9:41,Michael Porter Jr. makes 2-foot dunk,84,110,Nets
9:28,Alperen Sengun steps out of bounds turnover,84,110,Rockets
9:13,Michael Porter Jr. lost ball turnover (Josh Okogie steals),84,110,Nets
9:09,Tari Eason makes two point shot,84,112,Rockets
9:00,Tyrese Martin makes 26-foot three point jumper (Nolan Traore assists),87,112,Nets
8:47,Reed Sheppard misses 24-foot three point pullup jump shot,87,112,Rockets
8:45,Terance Mann defensive rebound,87,112,Nets
8:40,Michael Porter Jr. offensive foul,87,112,Nets
8:40,Michael Porter Jr. turnover,87,112,Nets
8:40,Amen Thompson enters the game for Alperen Sengun,87,112,Rockets
8:40,Jalen Wilson enters the game for Michael Porter Jr.,87,112,Nets
8:27,Clint Capela makes 5-foot dunk (Reed Sheppard assists),87,114,Rockets
8:10,Tari Eason blocks Nic Claxton 's 2-foot dunk,87,114,Nets
8:07,Nic Claxton offensive rebound,87,114,Nets
8:05,Tyrese Martin misses 22-foot three point jumper,87,114,Nets
8:04,Terance Mann offensive rebound,87,114,Nets
8:04,Terance Mann makes dunk,89,114,Nets
7:40,Reed Sheppard makes 25-foot three point step back jumpshot (Tari Eason assists),89,117,Rockets
7:25,Jalen Wilson makes layup,91,117,Nets
7:15,Reed Sheppard makes 27-foot three point jumper (Amen Thompson assists),91,120,Rockets
7:14,Nets Full timeout,91,120,Nets
7:14,JD Davison enters the game for Tari Eason,91,120,Rockets
7:14,Aaron Holiday enters the game for Josh Okogie,91,120,Rockets
7:14,Jae'Sean Tate enters the game for Amen Thompson,91,120,Rockets
7:14,Noah Clowney enters the game for Terance Mann,91,120,Nets
7:14,Day'Ron Sharpe enters the game for Nic Claxton,91,120,Nets
7:14,Ben Saraf enters the game for Nolan Traore,91,120,Nets
6:52,Clint Capela shooting foul,91,120,Rockets
6:52,Jalen Wilson makes free throw 1 of 2,92,120,Nets
6:52,Jalen Wilson makes free throw 2 of 2,93,120,Nets
6:34,Reed Sheppard makes 11-foot two point shot,93,122,Rockets
6:18,Ben Saraf misses 25-foot three point jumper,93,122,Nets
6:18,Clint Capela defensive rebound,93,122,Rockets
6:07,Aaron Holiday makes 25-foot three point shot (Reed Sheppard assists),93,125,Rockets
5:44,Jalen Wilson makes 9-foot two point shot (Day'Ron Sharpe assists),95,125,Nets
5:25,Tyson Etienne enters the game for Tyrese Martin,95,125,Nets
5:25,E.J. Liddell enters the game for Noah Clowney,95,125,Nets
5:23,Reed Sheppard misses 28-foot three point jumper,95,125,Rockets
5:20,Day'Ron Sharpe defensive rebound,95,125,Nets
5:03,Day'Ron Sharpe misses 25-foot three point jumper,95,125,Nets
5:03,Nets offensive team rebound,95,125,Nets
4:55,Jalen Wilson misses driving layup,95,125,Nets
4:52,Day'Ron Sharpe offensive rebound,95,125,Nets
4:48,Day'Ron Sharpe makes tip shot,97,125,Nets
4:34,JD Davison misses 25-foot three point jumper,97,125,Rockets
4:34,E.J. Liddell defensive rebound,97,125,Nets
4:23,Jalen Wilson vs. Jae'Sean Tate (Aaron Holiday gains possession),97,125,Rockets
4:23,Jalen Wilson lost ball turnover (Jae'Sean Tate steals),97,125,Nets
4:21,Aaron Holiday makes two point shot,97,127,Rockets
4:06,Jalen Wilson misses layup,97,127,Nets
4:04,Jae'Sean Tate defensive rebound,97,127,Rockets
3:59,JD Davison makes 24-foot three point jumper (Reed Sheppard assists),97,130,Rockets
3:58,Nets Full timeout,97,130,Nets
