time,description,home_score,away_score,team
12:00,Jakob Poeltl vs. Dereck Lively II (Brandon Ingram gains possession),0,0,Raptors
11:44,Jakob Poeltl makes layup (Scottie Barnes assists),2,0,Raptors
11:30,Dereck Lively II bad pass (Jakob Poeltl steals),2,0,Mavericks
11:27,Immanuel Quickley makes two point shot,4,0,Raptors
11:16,Klay Thompson makes 25-foot three point jumper (Dereck Lively II assists),4,3,Mavericks
11:03,Dereck Lively II blocks Brandon Ingram 's 3-foot driving dunk,4,3,Raptors
11:01,Klay Thompson defensive rebound,4,3,Mavericks
10:58,P.J. Washington makes 1-foot dunk (Klay Thompson assists),4,5,Mavericks
10:52,Klay Thompson personal foul,4,5,Mavericks
10:43,Scottie Barnes makes 16-foot jumper (Brandon Ingram assists),6,5,Raptors
10:29,Scottie Barnes personal foul,6,5,Raptors
10:20,P.J. Washington makes 7-foot two point shot,6,7,Mavericks
10:01,Scottie Barnes misses 23-foot three point jumper,6,7,Raptors
9:59,Klay Thompson defensive rebound,6,7,Mavericks
9:46,Klay Thompson bad pass (Brandon Ingram steals),6,7,Mavericks
9:37,Brandon Ingram makes 17-foot pullup jump shot,8,7,Raptors
9:13,P.J. Washington misses 22-foot three point jumper,8,7,Mavericks
9:11,Jakob Poeltl defensive rebound,8,7,Raptors
9:06,Immanuel Quickley misses 23-foot three point shot,8,7,Raptors
9:04,P.J. Washington defensive rebound,8,7,Mavericks
8:59,Cooper Flagg makes 1-foot dunk (P.J. Washington assists),8,9,Mavericks
8:43,RJ Barrett makes driving layup (Jakob Poeltl assists),10,9,Raptors
8:43,Dereck Lively II shooting foul,10,9,Mavericks
8:43,RJ Barrett makes free throw 1 of 1,11,9,Raptors
8:31,P.J. Washington bad pass (Immanuel Quickley steals),11,9,Mavericks
8:27,Brandon Ingram misses 25-foot three point shot,11,9,Raptors
8:24,Anthony Davis defensive rebound,11,9,Mavericks
8:07,Klay Thompson makes 20-foot step back jumpshot (Anthony Davis assists),11,11,Mavericks
7:42,shot clock turnover,11,11,Raptors
7:42,D'Angelo Russell enters the game for P.J. Washington,11,11,Mavericks
7:26,Dereck Lively II makes 1-foot alley oop dunk shot (Klay Thompson assists),11,13,Mavericks
7:14,RJ Barrett makes 10-foot driving floating jump shot (Scottie Barnes assists),13,13,Raptors
7:14,Anthony Davis shooting foul,13,13,Mavericks
7:14,Naji Marshall enters the game for Anthony Davis,13,13,Mavericks
7:14,Collin Murray-Boyles enters the game for Scottie Barnes,13,13,Raptors
7:14,RJ Barrett misses free throw 1 of 1,13,13,Raptors
7:12,Dereck Lively II defensive rebound,13,13,Mavericks
7:00,D'Angelo Russell misses 16-foot two point shot,13,13,Mavericks
6:57,Brandon Ingram defensive rebound,13,13,Raptors
6:49,RJ Barrett misses driving floating jump shot,13,13,Raptors
6:47,Dereck Lively II defensive rebound,13,13,Mavericks
6:35,Mavericks Full timeout,13,13,Mavericks
6:35,Max Christie enters the game for Klay Thompson,13,13,Mavericks
6:35,Gradey Dick enters the game for RJ Barrett,13,13,Raptors
6:26,Cooper Flagg makes driving layup,13,15,Mavericks
6:26,Jakob Poeltl shooting foul,13,15,Raptors
6:26,Cooper Flagg makes free throw 1 of 1,13,16,Mavericks
6:10,Gradey Dick misses driving layup,13,16,Raptors
6:07,Dereck Lively II defensive rebound,13,16,Mavericks
6:05,D'Angelo Russell out of bounds bad pass turnover,13,16,Mavericks
5:52,Jakob Poeltl lost ball turnover (D'Angelo Russell steals),13,16,Raptors
5:42,Jakob Poeltl shooting foul,13,16,Raptors
5:42,Dereck Lively II misses free throw 1 of 2,13,16,Mavericks
5:42,Mavericks offensive team rebound,13,16,Mavericks
5:42,Sandro Mamukelashvili enters the game for Jakob Poeltl,13,16,Raptors
5:42,Dereck Lively II misses free throw 2 of 2,13,16,Mavericks
5:40,Brandon Ingram defensive rebound,13,16,Raptors
5:27,Sandro Mamukelashvili misses 25-foot three point jumper,13,16,Raptors
5:24,D'Angelo Russell defensive rebound,13,16,Mavericks
5:19,Collin Murray-Boyles shooting foul,13,16,Raptors
5:19,D'Angelo Russell makes free throw 1 of 2,13,17,Mavericks
5:19,Anthony Davis enters the game for Dereck Lively II,13,17,Mavericks
5:19,RJ Barrett enters the game for Collin Murray-Boyles,13,17,Raptors
5:19,D'Angelo Russell misses free throw 2 of 2,13,17,Mavericks
5:16,RJ Barrett defensive rebound,13,17,Raptors
5:11,P.J. Washington enters the game for Cooper Flagg,13,17,Mavericks
5:01,Immanuel Quickley misses 7-foot two point shot,13,17,Raptors
4:59,Immanuel Quickley offensive rebound,13,17,Raptors
4:57,Immanuel Quickley bad pass (P.J. Washington steals),13,17,Raptors
4:52,RJ Barrett shooting foul,13,17,Raptors
4:52,D'Angelo Russell makes free throw 1 of 2,13,18,Mavericks
4:52,Jamal Shead enters the game for Brandon Ingram,13,18,Raptors
4:52,Scottie Barnes enters the game for Immanuel Quickley,13,18,Raptors
4:52,D'Angelo Russell makes free throw 2 of 2,13,19,Mavericks
4:44,Scottie Barnes makes 11-foot jumper (Jamal Shead assists),15,19,Raptors
4:40,P.J. Washington out of bounds bad pass turnover,15,19,Mavericks
4:36,Max Christie kicked ball violation,15,19,Mavericks
4:23,Scottie Barnes misses 15-foot jumper,15,19,Raptors
4:21,Naji Marshall defensive rebound,15,19,Mavericks
4:15,Naji Marshall makes 6-foot two point shot (D'Angelo Russell assists),15,21,Mavericks
4:14,Raptors Full timeout,15,21,Raptors
4:02,RJ Barrett makes 25-foot three point jumper (Sandro Mamukelashvili assists),18,21,Raptors
3:48,D'Angelo Russell misses 25-foot three point jumper,18,21,Mavericks
3:48,Anthony Davis offensive rebound,18,21,Mavericks
3:45,Anthony Davis makes two point shot,18,23,Mavericks
3:36,Sandro Mamukelashvili misses 27-foot three point jumper,18,23,Raptors
3:32,Naji Marshall defensive rebound,18,23,Mavericks
3:20,D'Angelo Russell misses layup,18,23,Mavericks
3:18,RJ Barrett defensive rebound,18,23,Raptors
3:14,Sandro Mamukelashvili makes two point shot (Jamal Shead assists),20,23,Raptors
2:56,Gradey Dick personal foul,20,23,Raptors
2:56,(02:56) [Raptors] REF-INITIATED REVIEW (CALL STANDS),20,23,Unknown
2:56,D'Angelo Russell makes free throw 1 of 2,20,24,Mavericks
2:56,D'Angelo Russell misses free throw 2 of 2,20,24,Mavericks
2:54,RJ Barrett defensive rebound,20,24,Raptors
2:38,P.J. Washington shooting foul,20,24,Mavericks
2:38,Sandro Mamukelashvili makes free throw 1 of 2,21,24,Raptors
2:38,Jaden Hardy enters the game for D'Angelo Russell,21,24,Mavericks
2:38,Sandro Mamukelashvili makes free throw 2 of 2,22,24,Raptors
2:22,Max Christie makes 24-foot three point jumper (P.J. Washington assists),22,27,Mavericks
2:12,Sandro Mamukelashvili makes 26-foot three point jumper (Scottie Barnes assists),25,27,Raptors
1:45,Anthony Davis makes 21-foot two point shot,25,29,Mavericks
1:33,Gradey Dick misses 22-foot three point jumper,25,29,Raptors
1:31,Max Christie defensive rebound,25,29,Mavericks
1:30,Max Christie out of bounds bad pass turnover,25,29,Mavericks
1:17,Sandro Mamukelashvili makes 5-foot driving floating jump shot (Jamal Shead assists),27,29,Raptors
1:06,P.J. Washington misses driving layup,27,29,Mavericks
1:05,Sandro Mamukelashvili defensive rebound,27,29,Raptors
1:00,Scottie Barnes makes 25-foot three point jumper (RJ Barrett assists),30,29,Raptors
44.9,Max Christie bad pass (Gradey Dick steals),30,29,Mavericks
41.5,Scottie Barnes makes two point shot (Jamal Shead assists),32,29,Raptors
31.9,Anthony Davis offensive foul,32,29,Mavericks
31.9,Anthony Davis turnover,32,29,Mavericks
15.8,Scottie Barnes misses 7-foot two point shot,32,29,Raptors
13.4,Jaden Hardy defensive rebound,32,29,Mavericks
8.7,Naji Marshall makes 2-foot layup (P.J. Washington assists),32,31,Mavericks
8.7,Jamal Shead shooting foul,32,31,Raptors
8.7,Dereck Lively II enters the game for Anthony Davis,32,31,Mavericks
8.7,Brandon Ingram enters the game for Gradey Dick,32,31,Raptors
8.7,Naji Marshall makes free throw 1 of 1,32,32,Mavericks
8.7,Caleb Martin enters the game for Jaden Hardy,32,32,Mavericks
0.2,Scottie Barnes misses 25-foot three point jumper,32,32,Raptors
0.2,Raptors offensive team rebound,32,32,Raptors
0.0,End of the 1st Quarter,32,32,Unknown
,[ QUARTER 1 ENDED ],,,
12:00,D'Angelo Russell enters the game for Naji Marshall,32,32,Mavericks
12:00,Anthony Davis enters the game for Dereck Lively II,32,32,Mavericks
12:00,Collin Murray-Boyles enters the game for Scottie Barnes,32,32,Raptors
12:00,Ochai Agbaji enters the game for RJ Barrett,32,32,Raptors
12:00,Immanuel Quickley enters the game for Jamal Shead,32,32,Raptors
11:43,Brandon Ingram shooting foul,32,32,Raptors
11:43,Max Christie makes free throw 1 of 2,32,33,Mavericks
11:43,Max Christie makes free throw 2 of 2,32,34,Mavericks
11:28,Brandon Ingram misses 11-foot two point shot,32,34,Raptors
11:27,Collin Murray-Boyles offensive rebound,32,34,Raptors
11:27,Collin Murray-Boyles misses dunk,32,34,Raptors
11:26,Immanuel Quickley offensive rebound,32,34,Raptors
11:24,Immanuel Quickley makes two point shot,34,34,Raptors
11:04,P.J. Washington misses 22-foot three point jumper,34,34,Mavericks
11:01,Immanuel Quickley defensive rebound,34,34,Raptors
10:53,Immanuel Quickley makes 25-foot three point jumper (Sandro Mamukelashvili assists),37,34,Raptors
10:38,Immanuel Quickley shooting foul,37,34,Raptors
10:38,D'Angelo Russell makes free throw 1 of 2,37,35,Mavericks
10:38,Klay Thompson enters the game for Max Christie,37,35,Mavericks
10:38,D'Angelo Russell makes free throw 2 of 2,37,36,Mavericks
10:30,Caleb Martin personal foul,37,36,Mavericks
10:22,Brandon Ingram makes 14-foot two point shot (Immanuel Quickley assists),39,36,Raptors
10:07,Klay Thompson makes 24-foot three point jumper (D'Angelo Russell assists),39,39,Mavericks
10:00,Brandon Ingram lost ball turnover (Caleb Martin steals),39,39,Raptors
9:54,D'Angelo Russell misses 23-foot three point pullup jump shot,39,39,Mavericks
9:53,D'Angelo Russell offensive rebound,39,39,Mavericks
9:51,Klay Thompson misses 22-foot three point jumper,39,39,Mavericks
9:50,Raptors defensive team rebound,39,39,Raptors
9:37,Immanuel Quickley misses 25-foot three point jumper,39,39,Raptors
9:32,P.J. Washington defensive rebound,39,39,Mavericks
9:25,P.J. Washington misses driving layup,39,39,Mavericks
9:22,P.J. Washington offensive rebound,39,39,Mavericks
9:19,Brandon Ingram shooting foul,39,39,Raptors
9:19,Anthony Davis makes free throw 1 of 2,39,40,Mavericks
9:19,Cooper Flagg enters the game for P.J. Washington,39,40,Mavericks
9:19,Jakob Poeltl enters the game for Sandro Mamukelashvili,39,40,Raptors
9:19,Anthony Davis makes free throw 2 of 2,39,41,Mavericks
9:06,Brandon Ingram makes 17-foot pullup jump shot (Jakob Poeltl assists),41,41,Raptors
8:52,Anthony Davis makes 1-foot layup (Klay Thompson assists),41,43,Mavericks
8:37,Ochai Agbaji misses 24-foot three point jumper,41,43,Raptors
8:34,Anthony Davis defensive rebound,41,43,Mavericks
8:21,D'Angelo Russell misses 22-foot three point jumper,41,43,Mavericks
8:19,D'Angelo Russell offensive rebound,41,43,Mavericks
8:17,D'Angelo Russell misses 22-foot three point jumper,41,43,Mavericks
8:17,Anthony Davis offensive rebound,41,43,Mavericks
8:17,Jakob Poeltl shooting foul,41,43,Raptors
8:17,Anthony Davis misses free throw 1 of 2,41,43,Mavericks
8:17,Mavericks offensive team rebound,41,43,Mavericks
8:17,Scottie Barnes enters the game for Brandon Ingram,41,43,Raptors
8:17,Jamal Shead enters the game for Immanuel Quickley,41,43,Raptors
8:17,RJ Barrett enters the game for Jakob Poeltl,41,43,Raptors
8:17,Anthony Davis misses free throw 2 of 2,41,43,Mavericks
8:15,Scottie Barnes defensive rebound,41,43,Raptors
8:10,Collin Murray-Boyles misses two point shot,41,43,Raptors
8:08,Caleb Martin defensive rebound,41,43,Mavericks
7:56,Anthony Davis makes 5-foot two point shot,41,45,Mavericks
7:38,Collin Murray-Boyles bad pass (D'Angelo Russell steals),41,45,Raptors
7:31,D'Angelo Russell misses driving floating jump shot,41,45,Mavericks
7:28,Scottie Barnes defensive rebound,41,45,Raptors
7:23,RJ Barrett lost ball turnover (Anthony Davis steals),41,45,Raptors
7:18,Klay Thompson lost ball turnover (Ochai Agbaji steals),41,45,Mavericks
7:15,Ochai Agbaji makes 25-foot three point shot (Jamal Shead assists),44,45,Raptors
7:14,Mavericks Full timeout,44,45,Mavericks
7:14,Dereck Lively II enters the game for Anthony Davis,44,45,Mavericks
7:14,Naji Marshall enters the game for Caleb Martin,44,45,Mavericks
6:53,Klay Thompson misses 18-foot two point shot,44,45,Mavericks
6:49,Ochai Agbaji defensive rebound,44,45,Raptors
6:45,Jamal Shead makes 26-foot three point shot (RJ Barrett assists),47,45,Raptors
6:33,Cooper Flagg makes 1-foot dunk,47,47,Mavericks
6:29,Klay Thompson shooting foul,47,47,Mavericks
6:29,Ochai Agbaji makes free throw 1 of 2,48,47,Raptors
6:29,Max Christie enters the game for Klay Thompson,48,47,Mavericks
6:29,Ochai Agbaji makes free throw 2 of 2,49,47,Raptors
6:02,D'Angelo Russell makes 24-foot three point shot (Max Christie assists),49,50,Mavericks
5:57,D'Angelo Russell personal foul,49,50,Mavericks
5:47,RJ Barrett makes 4-foot two point shot,51,50,Raptors
5:41,Max Christie makes dunk (D'Angelo Russell assists),51,52,Mavericks
5:24,Ochai Agbaji misses 25-foot three point jumper,51,52,Raptors
5:22,Collin Murray-Boyles offensive rebound,51,52,Raptors
5:19,RJ Barrett misses 24-foot three point jumper,51,52,Raptors
5:16,Cooper Flagg defensive rebound,51,52,Mavericks
4:59,D'Angelo Russell misses 24-foot three point jumper,51,52,Mavericks
4:56,Ochai Agbaji defensive rebound,51,52,Raptors
4:49,Scottie Barnes makes 25-foot three point jumper (Jamal Shead assists),54,52,Raptors
4:32,Cooper Flagg makes 24-foot three point jumper (D'Angelo Russell assists),54,55,Mavericks
4:07,Scottie Barnes misses driving floating jump shot,54,55,Raptors
4:05,Scottie Barnes offensive rebound,54,55,Raptors
4:05,Scottie Barnes makes tip shot,56,55,Raptors
3:46,D'Angelo Russell bad pass,56,55,Mavericks
3:46,Dereck Lively II loose ball foul,56,55,Mavericks
3:46,Raptors Full timeout,56,55,Raptors
3:46,P.J. Washington enters the game for Dereck Lively II,56,55,Mavericks
3:46,Anthony Davis enters the game for D'Angelo Russell,56,55,Mavericks
3:46,Sandro Mamukelashvili enters the game for Collin Murray-Boyles,56,55,Raptors
3:46,Brandon Ingram enters the game for Jamal Shead,56,55,Raptors
3:46,Immanuel Quickley enters the game for Ochai Agbaji,56,55,Raptors
3:27,RJ Barrett misses 6-foot two point shot,56,55,Raptors
3:25,Naji Marshall defensive rebound,56,55,Mavericks
3:12,Scottie Barnes kicked ball violation,56,55,Raptors
3:09,RJ Barrett personal foul,56,55,Raptors
3:09,Cooper Flagg makes free throw 1 of 2,56,56,Mavericks
3:09,Cooper Flagg makes free throw 2 of 2,56,57,Mavericks
2:53,Sandro Mamukelashvili makes 1-foot driving dunk (Brandon Ingram assists),58,57,Raptors
2:41,Cooper Flagg misses 26-foot three point pullup jump shot,58,57,Mavericks
2:38,Brandon Ingram defensive rebound,58,57,Raptors
2:25,Cooper Flagg shooting foul,58,57,Mavericks
2:25,Immanuel Quickley makes free throw 1 of 2,59,57,Raptors
2:25,Ochai Agbaji enters the game for RJ Barrett,59,57,Raptors
2:25,Immanuel Quickley makes free throw 2 of 2,60,57,Raptors
2:15,Max Christie makes 22-foot three point jumper (Cooper Flagg assists),60,60,Mavericks
2:04,Brandon Ingram misses driving layup,60,60,Raptors
2:02,P.J. Washington defensive rebound,60,60,Mavericks
1:44,Anthony Davis bad pass (Brandon Ingram steals),60,60,Mavericks
1:40,Scottie Barnes makes dunk (Immanuel Quickley assists),62,60,Raptors
1:29,Naji Marshall traveling,62,60,Mavericks
1:29,D'Angelo Russell enters the game for Naji Marshall,62,60,Mavericks
1:07,Brandon Ingram makes 15-foot pullup jump shot,64,60,Raptors
50.1,P.J. Washington misses 17-foot step back jumpshot,64,60,Mavericks
47.4,Immanuel Quickley defensive rebound,64,60,Raptors
43.5,Sandro Mamukelashvili makes two point shot (Immanuel Quickley assists),66,60,Raptors
30.3,D'Angelo Russell makes 8-foot two point shot,66,62,Mavericks
10.6,Immanuel Quickley misses driving floating jump shot,66,62,Raptors
8.9,Anthony Davis defensive rebound,66,62,Mavericks
6.6,Collin Murray-Boyles enters the game for Brandon Ingram,66,62,Raptors
6.6,Jamal Shead enters the game for Immanuel Quickley,66,62,Raptors
2.3,D'Angelo Russell makes 17-foot two point shot (Max Christie assists),66,64,Mavericks
0.4,Cooper Flagg blocks Sandro Mamukelashvili 's 56-foot heave jump shot,66,64,Raptors
0.1,Raptors offensive team rebound,66,64,Raptors
0.0,End of the 2nd Quarter,66,64,Unknown
,[ QUARTER 2 ENDED ],,,
12:00,Klay Thompson enters the game for Max Christie,66,64,Mavericks
12:00,Dereck Lively II enters the game for D'Angelo Russell,66,64,Mavericks
12:00,Brandon Ingram enters the game for Ochai Agbaji,66,64,Raptors
12:00,Immanuel Quickley enters the game for Collin Murray-Boyles,66,64,Raptors
12:00,RJ Barrett enters the game for Jamal Shead,66,64,Raptors
11:48,Cooper Flagg misses 10-foot jumper,66,64,Mavericks
11:44,Scottie Barnes defensive rebound,66,64,Raptors
11:36,Cooper Flagg shooting foul,66,64,Mavericks
11:36,Scottie Barnes makes free throw 1 of 2,67,64,Raptors
11:36,Jakob Poeltl enters the game for Sandro Mamukelashvili,67,64,Raptors
11:36,Scottie Barnes misses free throw 2 of 2,67,64,Raptors
11:34,Cooper Flagg defensive rebound,67,64,Mavericks
11:29,P.J. Washington makes 2-foot dunk,67,66,Mavericks
11:29,RJ Barrett shooting foul,67,66,Raptors
11:29,P.J. Washington makes free throw 1 of 1,67,67,Mavericks
11:11,Brandon Ingram makes 17-foot two point shot (Scottie Barnes assists),69,67,Raptors
10:59,Dereck Lively II makes 1-foot alley oop dunk shot (Cooper Flagg assists),69,69,Mavericks
10:38,RJ Barrett makes 4-foot two point shot (Scottie Barnes assists),71,69,Raptors
10:27,Anthony Davis misses 22-foot three point jumper,71,69,Mavericks
10:24,Brandon Ingram defensive rebound,71,69,Raptors
10:14,Brandon Ingram makes 25-foot three pointer,74,69,Raptors
10:03,Dereck Lively II offensive foul,74,69,Mavericks
10:03,Dereck Lively II turnover,74,69,Mavericks
9:49,Brandon Ingram makes 5-foot driving floating jump shot,76,69,Raptors
9:37,RJ Barrett shooting foul,76,69,Raptors
9:37,P.J. Washington makes free throw 1 of 2,76,70,Mavericks
9:37,Ochai Agbaji enters the game for RJ Barrett,76,70,Raptors
9:37,P.J. Washington misses free throw 2 of 2,76,70,Mavericks
9:35,Scottie Barnes defensive rebound,76,70,Raptors
9:26,Brandon Ingram misses 10-foot two point shot,76,70,Raptors
9:23,Jakob Poeltl offensive rebound,76,70,Raptors
9:15,Dereck Lively II blocks Ochai Agbaji 's 4-foot driving dunk,76,70,Raptors
9:13,Cooper Flagg defensive rebound,76,70,Mavericks
9:07,P.J. Washington misses driving layup,76,70,Mavericks
9:04,Anthony Davis offensive rebound,76,70,Mavericks
9:04,Anthony Davis makes tip shot,76,72,Mavericks
9:00,Scottie Barnes offensive foul,76,72,Raptors
9:00,Scottie Barnes turnover,76,72,Raptors
8:57,Immanuel Quickley personal foul,76,72,Raptors
8:45,Anthony Davis makes 1-foot alley oop dunk shot (Cooper Flagg assists),76,74,Mavericks
8:35,Scottie Barnes misses 10-foot two point shot,76,74,Raptors
8:33,Anthony Davis defensive rebound,76,74,Mavericks
8:31,Jakob Poeltl personal foul,76,74,Raptors
8:31,Sandro Mamukelashvili enters the game for Jakob Poeltl,76,74,Raptors
8:23,Cooper Flagg misses 25-foot three point pullup jump shot,76,74,Mavericks
8:20,Brandon Ingram defensive rebound,76,74,Raptors
8:10,Brandon Ingram bad pass (Anthony Davis steals),76,74,Raptors
8:06,Anthony Davis makes 1-foot dunk,76,76,Mavericks
8:06,Raptors Full timeout,76,76,Raptors
7:54,Immanuel Quickley misses 24-foot three point jumper,76,76,Raptors
7:51,Scottie Barnes offensive rebound,76,76,Raptors
7:44,Dereck Lively II blocks Immanuel Quickley 's 9-foot driving layup,76,76,Raptors
7:42,Klay Thompson defensive rebound,76,76,Mavericks
7:30,Klay Thompson misses 26-foot three point jumper,76,76,Mavericks
7:27,Scottie Barnes defensive rebound,76,76,Raptors
7:24,Immanuel Quickley misses running pullup jump shot,76,76,Raptors
7:20,Klay Thompson defensive rebound,76,76,Mavericks
7:09,Anthony Davis misses driving floating jump shot,76,76,Mavericks
7:07,Dereck Lively II offensive rebound,76,76,Mavericks
7:03,Cooper Flagg misses driving layup,76,76,Mavericks
7:00,Anthony Davis offensive rebound,76,76,Mavericks
7:00,Anthony Davis makes dunk,76,78,Mavericks
6:54,Scottie Barnes makes driving layup,78,78,Raptors
6:54,Cooper Flagg shooting foul,78,78,Mavericks
6:54,Max Christie enters the game for Anthony Davis,78,78,Mavericks
6:54,Naji Marshall enters the game for P.J. Washington,78,78,Mavericks
6:54,Scottie Barnes makes free throw 1 of 1,79,78,Raptors
6:31,Klay Thompson makes 19-foot jumper (Dereck Lively II assists),79,80,Mavericks
6:23,Scottie Barnes makes 24-foot three pointer,82,80,Raptors
6:13,Ochai Agbaji personal foul,82,80,Raptors
6:13,Naji Marshall makes free throw 1 of 2,82,81,Mavericks
6:13,Collin Murray-Boyles enters the game for Scottie Barnes,82,81,Raptors
6:13,Naji Marshall makes free throw 2 of 2,82,82,Mavericks
6:05,Immanuel Quickley makes driving layup,84,82,Raptors
6:05,Klay Thompson shooting foul,84,82,Mavericks
6:05,D'Angelo Russell enters the game for Klay Thompson,84,82,Mavericks
6:05,Immanuel Quickley makes free throw 1 of 1,85,82,Raptors
5:47,Cooper Flagg makes driving layup,85,84,Mavericks
5:33,Collin Murray-Boyles misses 7-foot two point shot,85,84,Raptors
5:32,Dereck Lively II defensive rebound,85,84,Mavericks
5:23,Cooper Flagg misses 25-foot three point jumper,85,84,Mavericks
5:20,Ochai Agbaji defensive rebound,85,84,Raptors
5:12,Immanuel Quickley misses 26-foot three point jumper,85,84,Raptors
5:09,Dereck Lively II defensive rebound,85,84,Mavericks
4:56,D'Angelo Russell makes 5-foot driving floating jump shot (Dereck Lively II assists),85,86,Mavericks
4:30,Brandon Ingram misses 7-foot two point shot,85,86,Raptors
4:28,Cooper Flagg defensive rebound,85,86,Mavericks
4:25,Max Christie makes 1-foot dunk (Cooper Flagg assists),85,88,Mavericks
4:05,Ochai Agbaji misses 24-foot three point jumper,85,88,Raptors
4:03,Naji Marshall defensive rebound,85,88,Mavericks
3:56,Cooper Flagg makes 1-foot dunk (Naji Marshall assists),85,90,Mavericks
3:56,Raptors Full timeout,85,90,Raptors
3:56,Gradey Dick enters the game for Brandon Ingram,85,90,Raptors
3:56,Scottie Barnes enters the game for Immanuel Quickley,85,90,Raptors
3:56,Jamal Shead enters the game for Collin Murray-Boyles,85,90,Raptors
3:56,Jamison Battle enters the game for Ochai Agbaji,85,90,Raptors
3:39,Jamal Shead bad pass (Naji Marshall steals),85,90,Raptors
3:32,Naji Marshall makes two point shot,85,92,Mavericks
3:15,Scottie Barnes misses 1-foot two point shot,85,92,Raptors
3:13,Dereck Lively II defensive rebound,85,92,Mavericks
3:11,Cooper Flagg makes dunk (D'Angelo Russell assists),85,94,Mavericks
3:11,Sandro Mamukelashvili shooting foul,85,94,Raptors
3:11,Anthony Davis enters the game for Dereck Lively II,85,94,Mavericks
3:11,Jakob Poeltl enters the game for Sandro Mamukelashvili,85,94,Raptors
3:11,Cooper Flagg makes free throw 1 of 1,85,95,Mavericks
3:01,Jamison Battle misses driving floating jump shot,85,95,Raptors
2:58,Jakob Poeltl offensive rebound,85,95,Raptors
2:58,Jakob Poeltl makes tip shot,87,95,Raptors
2:33,Cooper Flagg misses 27-foot three point step back jumpshot,87,95,Mavericks
2:30,Gradey Dick defensive rebound,87,95,Raptors
2:23,Scottie Barnes misses driving layup,87,95,Raptors
2:20,Jakob Poeltl offensive rebound,87,95,Raptors
2:16,Jamal Shead misses 25-foot three point jumper,87,95,Raptors
2:13,Jakob Poeltl offensive rebound,87,95,Raptors
2:06,Scottie Barnes misses layup,87,95,Raptors
2:05,Scottie Barnes offensive rebound,87,95,Raptors
2:02,Scottie Barnes makes two point shot,89,95,Raptors
2:02,Mavericks Full timeout,89,95,Mavericks
2:02,P.J. Washington enters the game for Cooper Flagg,89,95,Mavericks
1:48,Max Christie misses driving floating jump shot,89,95,Mavericks
1:43,Naji Marshall offensive rebound,89,95,Mavericks
1:40,Max Christie makes 23-foot three point jumper (Naji Marshall assists),89,98,Mavericks
1:20,Scottie Barnes makes 17-foot step back jumpshot (Jakob Poeltl assists),91,98,Raptors
1:04,D'Angelo Russell makes 10-foot two point shot,91,100,Mavericks
54.5,Anthony Davis blocks Jakob Poeltl 's 5-foot layup,91,100,Raptors
51.9,Jakob Poeltl offensive rebound,91,100,Raptors
42.2,Scottie Barnes misses two point shot,91,100,Raptors
40.2,Naji Marshall defensive rebound,91,100,Mavericks
35.2,Max Christie misses 22-foot three point shot,91,100,Mavericks
32.5,Jamison Battle defensive rebound,91,100,Raptors
25.2,Scottie Barnes bad pass (Naji Marshall steals),91,100,Raptors
10.9,Naji Marshall makes 5-foot layup (P.J. Washington assists),91,102,Mavericks
10.9,Jamison Battle shooting foul,91,102,Raptors
10.9,Cooper Flagg enters the game for Anthony Davis,91,102,Mavericks
10.9,Caleb Martin enters the game for D'Angelo Russell,91,102,Mavericks
10.9,Brandon Ingram enters the game for Jamal Shead,91,102,Raptors
10.9,Immanuel Quickley enters the game for Jamison Battle,91,102,Raptors
10.9,Naji Marshall makes free throw 1 of 1,91,103,Mavericks
6.1,Max Christie personal take foul,91,103,Mavericks
1.8,Caleb Martin shooting foul,91,103,Mavericks
1.8,Jakob Poeltl misses free throw 1 of 2,91,103,Raptors
1.8,Raptors offensive team rebound,91,103,Raptors
1.8,Anthony Davis enters the game for Caleb Martin,91,103,Mavericks
1.8,Ochai Agbaji enters the game for Gradey Dick,91,103,Raptors
1.8,Jakob Poeltl misses free throw 2 of 2,91,103,Raptors
1.6,Scottie Barnes offensive rebound,91,103,Raptors
0.3,Anthony Davis blocks Scottie Barnes 's 8-foot two point shot,91,103,Raptors
0.1,Raptors offensive team rebound,91,103,Raptors
0.0,End of the 3rd Quarter,91,103,Unknown
,[ QUARTER 3 ENDED ],,,
12:00,Caleb Martin enters the game for Max Christie,91,103,Mavericks
